Customer,Ship-to,Billing Date,Billing Date_parsed,Billing Date_parsed_year,Billing Date_parsed_month,Billing Date_parsed_day,Material,Material_1,Quantity,Unit,Unit/CTN,CTN,Product Group,Flavor,Pack,Size
7 - Eleven,ศูนย์กระจายสินค้าขอนแก่น (W801),1/3/23,2023-01-03T00:00:00.000Z,2023,1,3,,100%Mandarin Orange Malee 200ml 3x8 Leaf,,BRI,,63.0,Fruit Juice,Orange-Mandarin,3*8,200 ml
7 - Eleven,ศูนย์กระจายสินค้า RDCชลบุรีใหม่ W121,1/3/23,2023-01-03T00:00:00.000Z,2023,1,3,,100%Mandarin Orange Malee 200ml 3x8 Leaf,,BRI,,63.0,Fruit Juice,Orange-Mandarin,3*8,200 ml
7 - Eleven,ศูนย์กระจายสินค้า RDC WESTมหาชัย,1/3/23,2023-01-03T00:00:00.000Z,2023,1,3,,100%Mandarin Orange Malee 200ml 3x8 Leaf,,BRI,,168.0,Fruit Juice,Orange-Mandarin,3*8,200 ml
7 - Eleven,ศูนย์กระจายสินค้า DC5 สุวรรณภูมิ,1/3/23,2023-01-03T00:00:00.000Z,2023,1,3,,100%Mandarin Orange Malee 200ml 3x8 Leaf,,BRI,,168.0,Fruit Juice,Orange-Mandarin,3*8,200 ml
7 - Eleven,ศุนย์กระจายสินค้า นครสวรรค์(RDC นครสวรรค์),1/3/23,2023-01-03T00:00:00.000Z,2023,1,3,,100%Mandarin Orange Malee 200ml 3x8 Leaf,,BRI,,147.0,Fruit Juice,Orange-Mandarin,3*8,200 ml
7 - Eleven,บริษัท ซีพี ออลล์ จำกัด (มหาชน),1/3/23,2023-01-03T00:00:00.000Z,2023,1,3,,100%Mandarin Orange Malee 200ml 3x8 Leaf,,BRI,,288.0,Fruit Juice,Orange-Mandarin,3*8,200 ml
7 - Eleven,ศูนย์กระจายสินค้า RDCชลบุรีใหม่ W121,1/9/23,2023-01-09T00:00:00.000Z,2023,1,9,,100%Mandarin Orange Malee 200ml 3x8 Leaf,,BRI,,420.0,Fruit Juice,Orange-Mandarin,3*8,200 ml
7 - Eleven,ศูนย์กระจายสินค้า RDC WESTมหาชัย,1/9/23,2023-01-09T00:00:00.000Z,2023,1,9,,100%Mandarin Orange Malee 200ml 3x8 Leaf,,BRI,,252.0,Fruit Juice,Orange-Mandarin,3*8,200 ml
7 - Eleven,ศูนย์กระจายสินค้า DC5 สุวรรณภูมิ,1/9/23,2023-01-09T00:00:00.000Z,2023,1,9,,100%Mandarin Orange Malee 200ml 3x8 Leaf,,BRI,,504.0,Fruit Juice,Orange-Mandarin,3*8,200 ml
7 - Eleven,บริษัท ซีพี ออลล์ จำกัด (มหาชน),1/9/23,2023-01-09T00:00:00.000Z,2023,1,9,,100%Mandarin Orange Malee 200ml 3x8 Leaf,,BRI,,600.0,Fruit Juice,Orange-Mandarin,3*8,200 ml
7 - Eleven,ศูนย์กระจายสินค้าขอนแก่น (W801),1/10/23,2023-01-10T00:00:00.000Z,2023,1,10,,100%Mandarin Orange Malee 200ml 3x8 Leaf,,BRI,,252.0,Fruit Juice,Orange-Mandarin,3*8,200 ml
7 - Eleven,ศูนย์กระจายสินค้า RDC WESTมหาชัย,1/10/23,2023-01-10T00:00:00.000Z,2023,1,10,,100%Mandarin Orange Malee 200ml 3x8 Leaf,,BRI,,63.0,Fruit Juice,Orange-Mandarin,3*8,200 ml
7 - Eleven,ศูนย์กระจายสินค้า DC5 สุวรรณภูมิ,1/10/23,2023-01-10T00:00:00.000Z,2023,1,10,,100%Mandarin Orange Malee 200ml 3x8 Leaf,,BRI,,168.0,Fruit Juice,Orange-Mandarin,3*8,200 ml
7 - Eleven,ศุนย์กระจายสินค้า นครสวรรค์(RDC นครสวรรค์),1/10/23,2023-01-10T00:00:00.000Z,2023,1,10,,100%Mandarin Orange Malee 200ml 3x8 Leaf,,BRI,,147.0,Fruit Juice,Orange-Mandarin,3*8,200 ml
7 - Eleven,บริษัท ซีพี ออลล์ จำกัด (มหาชน),1/10/23,2023-01-10T00:00:00.000Z,2023,1,10,,100%Mandarin Orange Malee 200ml 3x8 Leaf,,BRI,,692.0,Fruit Juice,Orange-Mandarin,3*8,200 ml
7 - Eleven,ศูนย์กระจายสินค้า RDCชลบุรีใหม่ W121,1/11/23,2023-01-11T00:00:00.000Z,2023,1,11,,100%Mandarin Orange Malee 200ml 3x8 Leaf,,BRI,,42.0,Fruit Juice,Orange-Mandarin,3*8,200 ml
7 - Eleven,ศูนย์กระจายสินค้า RDC สุราษฏร์ธานี,1/11/23,2023-01-11T00:00:00.000Z,2023,1,11,,100%Mandarin Orange Malee 200ml 3x8 Leaf,,BRI,,420.0,Fruit Juice,Orange-Mandarin,3*8,200 ml
7 - Eleven,ศุนย์กระจายสินค้า หาดใหญ่(RDC หาดใหญ่),1/11/23,2023-01-11T00:00:00.000Z,2023,1,11,,100%Mandarin Orange Malee 200ml 3x8 Leaf,,BRI,,168.0,Fruit Juice,Orange-Mandarin,3*8,200 ml
7 - Eleven,ศูนย์กระจายสินค้าขอนแก่น (W801),1/12/23,2023-01-12T00:00:00.000Z,2023,1,12,,100%Mandarin Orange Malee 200ml 3x8 Leaf,,BRI,,84.0,Fruit Juice,Orange-Mandarin,3*8,200 ml
7 - Eleven,ศูนย์กระจายสินค้า RDCชลบุรีใหม่ W121,1/12/23,2023-01-12T00:00:00.000Z,2023,1,12,,100%Mandarin Orange Malee 200ml 3x8 Leaf,,BRI,,168.0,Fruit Juice,Orange-Mandarin,3*8,200 ml
7 - Eleven,ศูนย์กระจายสินค้า DC5 สุวรรณภูมิ,1/12/23,2023-01-12T00:00:00.000Z,2023,1,12,,100%Mandarin Orange Malee 200ml 3x8 Leaf,,BRI,,168.0,Fruit Juice,Orange-Mandarin,3*8,200 ml
7 - Eleven,ศุนย์กระจายสินค้า นครสวรรค์(RDC นครสวรรค์),1/12/23,2023-01-12T00:00:00.000Z,2023,1,12,,100%Mandarin Orange Malee 200ml 3x8 Leaf,,BRI,,63.0,Fruit Juice,Orange-Mandarin,3*8,200 ml
7 - Eleven,บริษัท ซีพี ออลล์ จำกัด (มหาชน),1/12/23,2023-01-12T00:00:00.000Z,2023,1,12,,100%Mandarin Orange Malee 200ml 3x8 Leaf,,BRI,,167.0,Fruit Juice,Orange-Mandarin,3*8,200 ml
7 - Eleven,ศูนย์กระจายสินค้า RDC WESTมหาชัย,1/13/23,2023-01-13T00:00:00.000Z,2023,1,13,,100%Mandarin Orange Malee 200ml 3x8 Leaf,,BRI,,168.0,Fruit Juice,Orange-Mandarin,3*8,200 ml
7 - Eleven,ศูนย์กระจายสินค้า RDCชลบุรีใหม่ W121,1/14/23,2023-01-14T00:00:00.000Z,2023,1,14,,100%Mandarin Orange Malee 200ml 3x8 Leaf,,BRI,,105.0,Fruit Juice,Orange-Mandarin,3*8,200 ml
7 - Eleven,ศูนย์กระจายสินค้า RDC สุราษฏร์ธานี,1/14/23,2023-01-14T00:00:00.000Z,2023,1,14,,100%Mandarin Orange Malee 200ml 3x8 Leaf,,BRI,,63.0,Fruit Juice,Orange-Mandarin,3*8,200 ml
7 - Eleven,ศูนย์กระจายสินค้า RDC WESTมหาชัย,1/14/23,2023-01-14T00:00:00.000Z,2023,1,14,,100%Mandarin Orange Malee 200ml 3x8 Leaf,,BRI,,63.0,Fruit Juice,Orange-Mandarin,3*8,200 ml
7 - Eleven,ศูนย์กระจายสินค้า DC5 สุวรรณภูมิ,1/14/23,2023-01-14T00:00:00.000Z,2023,1,14,,100%Mandarin Orange Malee 200ml 3x8 Leaf,,BRI,,168.0,Fruit Juice,Orange-Mandarin,3*8,200 ml
7 - Eleven,ศุนย์กระจายสินค้า หาดใหญ่(RDC หาดใหญ่),1/14/23,2023-01-14T00:00:00.000Z,2023,1,14,,100%Mandarin Orange Malee 200ml 3x8 Leaf,,BRI,,21.0,Fruit Juice,Orange-Mandarin,3*8,200 ml
7 - Eleven,ศุนย์กระจายสินค้า นครสวรรค์(RDC นครสวรรค์),1/14/23,2023-01-14T00:00:00.000Z,2023,1,14,,100%Mandarin Orange Malee 200ml 3x8 Leaf,,BRI,,21.0,Fruit Juice,Orange-Mandarin,3*8,200 ml
7 - Eleven,บริษัท ซีพี ออลล์ จำกัด (มหาชน),1/14/23,2023-01-14T00:00:00.000Z,2023,1,14,,100%Mandarin Orange Malee 200ml 3x8 Leaf,,BRI,,40.0,Fruit Juice,Orange-Mandarin,3*8,200 ml
7 - Eleven,ศูนย์กระจายสินค้า RDCชลบุรีใหม่ W121,1/16/23,2023-01-16T00:00:00.000Z,2023,1,16,,100%Mandarin Orange Malee 200ml 3x8 Leaf,,BRI,,84.0,Fruit Juice,Orange-Mandarin,3*8,200 ml
7 - Eleven,ศูนย์กระจายสินค้า DC5 สุวรรณภูมิ,1/16/23,2023-01-16T00:00:00.000Z,2023,1,16,,100%Mandarin Orange Malee 200ml 3x8 Leaf,,BRI,,42.0,Fruit Juice,Orange-Mandarin,3*8,200 ml
7 - Eleven,บริษัท ซีพี ออลล์ จำกัด (มหาชน),1/16/23,2023-01-16T00:00:00.000Z,2023,1,16,,100%Mandarin Orange Malee 200ml 3x8 Leaf,,BRI,,435.0,Fruit Juice,Orange-Mandarin,3*8,200 ml
7 - Eleven,ศูนย์กระจายสินค้าขอนแก่น (W801),1/17/23,2023-01-17T00:00:00.000Z,2023,1,17,,100%Mandarin Orange Malee 200ml 3x8 Leaf,,BRI,,126.0,Fruit Juice,Orange-Mandarin,3*8,200 ml
7 - Eleven,ศูนย์กระจายสินค้า RDCชลบุรีใหม่ W121,1/17/23,2023-01-17T00:00:00.000Z,2023,1,17,,100%Mandarin Orange Malee 200ml 3x8 Leaf,,BRI,,105.0,Fruit Juice,Orange-Mandarin,3*8,200 ml
7 - Eleven,ศูนย์กระจายสินค้า DC5 สุวรรณภูมิ,1/17/23,2023-01-17T00:00:00.000Z,2023,1,17,,100%Mandarin Orange Malee 200ml 3x8 Leaf,,BRI,,105.0,Fruit Juice,Orange-Mandarin,3*8,200 ml
7 - Eleven,ศุนย์กระจายสินค้า นครสวรรค์(RDC นครสวรรค์),1/17/23,2023-01-17T00:00:00.000Z,2023,1,17,,100%Mandarin Orange Malee 200ml 3x8 Leaf,,BRI,,126.0,Fruit Juice,Orange-Mandarin,3*8,200 ml
7 - Eleven,บริษัท ซีพี ออลล์ จำกัด (มหาชน),1/17/23,2023-01-17T00:00:00.000Z,2023,1,17,,100%Mandarin Orange Malee 200ml 3x8 Leaf,,BRI,,140.0,Fruit Juice,Orange-Mandarin,3*8,200 ml
7 - Eleven,ศูนย์กระจายสินค้า RDCชลบุรีใหม่ W121,1/18/23,2023-01-18T00:00:00.000Z,2023,1,18,,100%Mandarin Orange Malee 200ml 3x8 Leaf,,BRI,,42.0,Fruit Juice,Orange-Mandarin,3*8,200 ml
7 - Eleven,ศูนย์กระจายสินค้า RDC สุราษฏร์ธานี,1/18/23,2023-01-18T00:00:00.000Z,2023,1,18,,100%Mandarin Orange Malee 200ml 3x8 Leaf,,BRI,,126.0,Fruit Juice,Orange-Mandarin,3*8,200 ml
7 - Eleven,ศูนย์กระจายสินค้า RDC WESTมหาชัย,1/18/23,2023-01-18T00:00:00.000Z,2023,1,18,,100%Mandarin Orange Malee 200ml 3x8 Leaf,,BRI,,168.0,Fruit Juice,Orange-Mandarin,3*8,200 ml
7 - Eleven,ศูนย์กระจายสินค้า DC5 สุวรรณภูมิ,1/18/23,2023-01-18T00:00:00.000Z,2023,1,18,,100%Mandarin Orange Malee 200ml 3x8 Leaf,,BRI,,84.0,Fruit Juice,Orange-Mandarin,3*8,200 ml
7 - Eleven,ศุนย์กระจายสินค้า หาดใหญ่(RDC หาดใหญ่),1/18/23,2023-01-18T00:00:00.000Z,2023,1,18,,100%Mandarin Orange Malee 200ml 3x8 Leaf,,BRI,,80.0,Fruit Juice,Orange-Mandarin,3*8,200 ml
7 - Eleven,บริษัท ซีพี ออลล์ จำกัด (มหาชน),1/18/23,2023-01-18T00:00:00.000Z,2023,1,18,,100%Mandarin Orange Malee 200ml 3x8 Leaf,,BRI,,144.0,Fruit Juice,Orange-Mandarin,3*8,200 ml
7 - Eleven,ศูนย์กระจายสินค้าขอนแก่น (W801),1/19/23,2023-01-19T00:00:00.000Z,2023,1,19,,100%Mandarin Orange Malee 200ml 3x8 Leaf,,BRI,,84.0,Fruit Juice,Orange-Mandarin,3*8,200 ml
7 - Eleven,ศูนย์กระจายสินค้า RDCชลบุรีใหม่ W121,1/19/23,2023-01-19T00:00:00.000Z,2023,1,19,,100%Mandarin Orange Malee 200ml 3x8 Leaf,,BRI,,42.0,Fruit Juice,Orange-Mandarin,3*8,200 ml
7 - Eleven,ศูนย์กระจายสินค้า RDC WESTมหาชัย,1/19/23,2023-01-19T00:00:00.000Z,2023,1,19,,100%Mandarin Orange Malee 200ml 3x8 Leaf,,BRI,,63.0,Fruit Juice,Orange-Mandarin,3*8,200 ml
7 - Eleven,ศูนย์กระจายสินค้า DC5 สุวรรณภูมิ,1/19/23,2023-01-19T00:00:00.000Z,2023,1,19,,100%Mandarin Orange Malee 200ml 3x8 Leaf,,BRI,,42.0,Fruit Juice,Orange-Mandarin,3*8,200 ml
7 - Eleven,ศุนย์กระจายสินค้า นครสวรรค์(RDC นครสวรรค์),1/19/23,2023-01-19T00:00:00.000Z,2023,1,19,,100%Mandarin Orange Malee 200ml 3x8 Leaf,,BRI,,63.0,Fruit Juice,Orange-Mandarin,3*8,200 ml
7 - Eleven,บริษัท ซีพี ออลล์ จำกัด (มหาชน),1/19/23,2023-01-19T00:00:00.000Z,2023,1,19,,100%Mandarin Orange Malee 200ml 3x8 Leaf,,BRI,,164.0,Fruit Juice,Orange-Mandarin,3*8,200 ml
7 - Eleven,ศูนย์กระจายสินค้า RDCชลบุรีใหม่ W121,1/20/23,2023-01-20T00:00:00.000Z,2023,1,20,,100%Mandarin Orange Malee 200ml 3x8 Leaf,,BRI,,84.0,Fruit Juice,Orange-Mandarin,3*8,200 ml
7 - Eleven,ศูนย์กระจายสินค้า RDC WESTมหาชัย,1/20/23,2023-01-20T00:00:00.000Z,2023,1,20,,100%Mandarin Orange Malee 200ml 3x8 Leaf,,BRI,,63.0,Fruit Juice,Orange-Mandarin,3*8,200 ml
7 - Eleven,ศูนย์กระจายสินค้า DC5 สุวรรณภูมิ,1/20/23,2023-01-20T00:00:00.000Z,2023,1,20,,100%Mandarin Orange Malee 200ml 3x8 Leaf,,BRI,,63.0,Fruit Juice,Orange-Mandarin,3*8,200 ml
7 - Eleven,บริษัท ซีพี ออลล์ จำกัด (มหาชน),1/20/23,2023-01-20T00:00:00.000Z,2023,1,20,,100%Mandarin Orange Malee 200ml 3x8 Leaf,,BRI,,144.0,Fruit Juice,Orange-Mandarin,3*8,200 ml
7 - Eleven,ศูนย์กระจายสินค้า RDCชลบุรีใหม่ W121,1/23/23,2023-01-23T00:00:00.000Z,2023,1,23,,100%Mandarin Orange Malee 200ml 3x8 Leaf,,BRI,,126.0,Fruit Juice,Orange-Mandarin,3*8,200 ml
7 - Eleven,ศูนย์กระจายสินค้า RDC สุราษฏร์ธานี,1/23/23,2023-01-23T00:00:00.000Z,2023,1,23,,100%Mandarin Orange Malee 200ml 3x8 Leaf,,BRI,,103.0,Fruit Juice,Orange-Mandarin,3*8,200 ml
7 - Eleven,ศูนย์กระจายสินค้า RDC WESTมหาชัย,1/23/23,2023-01-23T00:00:00.000Z,2023,1,23,,100%Mandarin Orange Malee 200ml 3x8 Leaf,,BRI,,105.0,Fruit Juice,Orange-Mandarin,3*8,200 ml
7 - Eleven,ศูนย์กระจายสินค้า DC5 สุวรรณภูมิ,1/23/23,2023-01-23T00:00:00.000Z,2023,1,23,,100%Mandarin Orange Malee 200ml 3x8 Leaf,,BRI,,252.0,Fruit Juice,Orange-Mandarin,3*8,200 ml
7 - Eleven,ศุนย์กระจายสินค้า หาดใหญ่(RDC หาดใหญ่),1/23/23,2023-01-23T00:00:00.000Z,2023,1,23,,100%Mandarin Orange Malee 200ml 3x8 Leaf,,BRI,,21.0,Fruit Juice,Orange-Mandarin,3*8,200 ml
7 - Eleven,ศุนย์กระจายสินค้า นครสวรรค์(RDC นครสวรรค์),1/23/23,2023-01-23T00:00:00.000Z,2023,1,23,,100%Mandarin Orange Malee 200ml 3x8 Leaf,,BRI,,62.0,Fruit Juice,Orange-Mandarin,3*8,200 ml
7 - Eleven,บริษัท ซีพี ออลล์ จำกัด (มหาชน),1/23/23,2023-01-23T00:00:00.000Z,2023,1,23,,100%Mandarin Orange Malee 200ml 3x8 Leaf,,BRI,,144.0,Fruit Juice,Orange-Mandarin,3*8,200 ml
7 - Eleven,ศูนย์กระจายสินค้าขอนแก่น (W801),1/24/23,2023-01-24T00:00:00.000Z,2023,1,24,,100%Mandarin Orange Malee 200ml 3x8 Leaf,,BRI,,105.0,Fruit Juice,Orange-Mandarin,3*8,200 ml
7 - Eleven,ศูนย์กระจายสินค้า RDCชลบุรีใหม่ W121,1/24/23,2023-01-24T00:00:00.000Z,2023,1,24,,100%Mandarin Orange Malee 200ml 3x8 Leaf,,BRI,,63.0,Fruit Juice,Orange-Mandarin,3*8,200 ml
7 - Eleven,ศูนย์กระจายสินค้า RDC WESTมหาชัย,1/24/23,2023-01-24T00:00:00.000Z,2023,1,24,,100%Mandarin Orange Malee 200ml 3x8 Leaf,,BRI,,84.0,Fruit Juice,Orange-Mandarin,3*8,200 ml
7 - Eleven,ศุนย์กระจายสินค้า นครสวรรค์(RDC นครสวรรค์),1/24/23,2023-01-24T00:00:00.000Z,2023,1,24,,100%Mandarin Orange Malee 200ml 3x8 Leaf,,BRI,,105.0,Fruit Juice,Orange-Mandarin,3*8,200 ml
7 - Eleven,บริษัท ซีพี ออลล์ จำกัด (มหาชน),1/24/23,2023-01-24T00:00:00.000Z,2023,1,24,,100%Mandarin Orange Malee 200ml 3x8 Leaf,,BRI,,401.0,Fruit Juice,Orange-Mandarin,3*8,200 ml
7 - Eleven,ศูนย์กระจายสินค้า RDCชลบุรีใหม่ W121,1/25/23,2023-01-25T00:00:00.000Z,2023,1,25,,100%Mandarin Orange Malee 200ml 3x8 Leaf,,BRI,,126.0,Fruit Juice,Orange-Mandarin,3*8,200 ml
7 - Eleven,ศูนย์กระจายสินค้า RDC สุราษฏร์ธานี,1/25/23,2023-01-25T00:00:00.000Z,2023,1,25,,100%Mandarin Orange Malee 200ml 3x8 Leaf,,BRI,,210.0,Fruit Juice,Orange-Mandarin,3*8,200 ml
7 - Eleven,ศูนย์กระจายสินค้า RDC WESTมหาชัย,1/25/23,2023-01-25T00:00:00.000Z,2023,1,25,,100%Mandarin Orange Malee 200ml 3x8 Leaf,,BRI,,42.0,Fruit Juice,Orange-Mandarin,3*8,200 ml
7 - Eleven,ศูนย์กระจายสินค้า DC5 สุวรรณภูมิ,1/25/23,2023-01-25T00:00:00.000Z,2023,1,25,,100%Mandarin Orange Malee 200ml 3x8 Leaf,,BRI,,105.0,Fruit Juice,Orange-Mandarin,3*8,200 ml
7 - Eleven,ศุนย์กระจายสินค้า หาดใหญ่(RDC หาดใหญ่),1/25/23,2023-01-25T00:00:00.000Z,2023,1,25,,100%Mandarin Orange Malee 200ml 3x8 Leaf,,BRI,,42.0,Fruit Juice,Orange-Mandarin,3*8,200 ml
7 - Eleven,ศูนย์กระจายสินค้าขอนแก่น (W801),1/26/23,2023-01-26T00:00:00.000Z,2023,1,26,,100%Mandarin Orange Malee 200ml 3x8 Leaf,,BRI,,42.0,Fruit Juice,Orange-Mandarin,3*8,200 ml
7 - Eleven,ศูนย์กระจายสินค้า RDC WESTมหาชัย,1/26/23,2023-01-26T00:00:00.000Z,2023,1,26,,100%Mandarin Orange Malee 200ml 3x8 Leaf,,BRI,,63.0,Fruit Juice,Orange-Mandarin,3*8,200 ml
7 - Eleven,ศูนย์กระจายสินค้า DC5 สุวรรณภูมิ,1/26/23,2023-01-26T00:00:00.000Z,2023,1,26,,100%Mandarin Orange Malee 200ml 3x8 Leaf,,BRI,,84.0,Fruit Juice,Orange-Mandarin,3*8,200 ml
7 - Eleven,ศุนย์กระจายสินค้า นครสวรรค์(RDC นครสวรรค์),1/26/23,2023-01-26T00:00:00.000Z,2023,1,26,,100%Mandarin Orange Malee 200ml 3x8 Leaf,,BRI,,84.0,Fruit Juice,Orange-Mandarin,3*8,200 ml
7 - Eleven,บริษัท ซีพี ออลล์ จำกัด (มหาชน),1/26/23,2023-01-26T00:00:00.000Z,2023,1,26,,100%Mandarin Orange Malee 200ml 3x8 Leaf,,BRI,,288.0,Fruit Juice,Orange-Mandarin,3*8,200 ml
7 - Eleven,ศูนย์กระจายสินค้า RDC WESTมหาชัย,1/27/23,2023-01-27T00:00:00.000Z,2023,1,27,,100%Mandarin Orange Malee 200ml 3x8 Leaf,,BRI,,42.0,Fruit Juice,Orange-Mandarin,3*8,200 ml
7 - Eleven,ศูนย์กระจายสินค้า DC5 สุวรรณภูมิ,1/27/23,2023-01-27T00:00:00.000Z,2023,1,27,,100%Mandarin Orange Malee 200ml 3x8 Leaf,,BRI,,105.0,Fruit Juice,Orange-Mandarin,3*8,200 ml
7 - Eleven,บริษัท ซีพี ออลล์ จำกัด (มหาชน),1/27/23,2023-01-27T00:00:00.000Z,2023,1,27,,100%Mandarin Orange Malee 200ml 3x8 Leaf,,BRI,,144.0,Fruit Juice,Orange-Mandarin,3*8,200 ml
7 - Eleven,ศูนย์กระจายสินค้าขอนแก่น (W801),1/28/23,2023-01-28T00:00:00.000Z,2023,1,28,,100%Mandarin Orange Malee 200ml 3x8 Leaf,,BRI,,63.0,Fruit Juice,Orange-Mandarin,3*8,200 ml
7 - Eleven,ศูนย์กระจายสินค้า RDCชลบุรีใหม่ W121,1/28/23,2023-01-28T00:00:00.000Z,2023,1,28,,100%Mandarin Orange Malee 200ml 3x8 Leaf,,BRI,,105.0,Fruit Juice,Orange-Mandarin,3*8,200 ml
7 - Eleven,ศูนย์กระจายสินค้า RDC สุราษฏร์ธานี,1/28/23,2023-01-28T00:00:00.000Z,2023,1,28,,100%Mandarin Orange Malee 200ml 3x8 Leaf,,BRI,,42.0,Fruit Juice,Orange-Mandarin,3*8,200 ml
7 - Eleven,ศูนย์กระจายสินค้า RDC WESTมหาชัย,1/28/23,2023-01-28T00:00:00.000Z,2023,1,28,,100%Mandarin Orange Malee 200ml 3x8 Leaf,,BRI,,105.0,Fruit Juice,Orange-Mandarin,3*8,200 ml
7 - Eleven,ศุนย์กระจายสินค้า หาดใหญ่(RDC หาดใหญ่),1/28/23,2023-01-28T00:00:00.000Z,2023,1,28,,100%Mandarin Orange Malee 200ml 3x8 Leaf,,BRI,,48.0,Fruit Juice,Orange-Mandarin,3*8,200 ml
7 - Eleven,ศุนย์กระจายสินค้า นครสวรรค์(RDC นครสวรรค์),1/28/23,2023-01-28T00:00:00.000Z,2023,1,28,,100%Mandarin Orange Malee 200ml 3x8 Leaf,,BRI,,42.0,Fruit Juice,Orange-Mandarin,3*8,200 ml
7 - Eleven,บริษัท ซีพี ออลล์ จำกัด (มหาชน),1/28/23,2023-01-28T00:00:00.000Z,2023,1,28,,100%Mandarin Orange Malee 200ml 3x8 Leaf,,BRI,,224.0,Fruit Juice,Orange-Mandarin,3*8,200 ml
7 - Eleven,ศูนย์กระจายสินค้า RDCชลบุรีใหม่ W121,1/30/23,2023-01-30T00:00:00.000Z,2023,1,30,,100%Mandarin Orange Malee 200ml 3x8 Leaf,,BRI,,63.0,Fruit Juice,Orange-Mandarin,3*8,200 ml
7 - Eleven,ศูนย์กระจายสินค้า RDC WESTมหาชัย,1/30/23,2023-01-30T00:00:00.000Z,2023,1,30,,100%Mandarin Orange Malee 200ml 3x8 Leaf,,BRI,,42.0,Fruit Juice,Orange-Mandarin,3*8,200 ml
7 - Eleven,ศูนย์กระจายสินค้า DC5 สุวรรณภูมิ,1/30/23,2023-01-30T00:00:00.000Z,2023,1,30,,100%Mandarin Orange Malee 200ml 3x8 Leaf,,BRI,,168.0,Fruit Juice,Orange-Mandarin,3*8,200 ml
7 - Eleven,บริษัท ซีพี ออลล์ จำกัด (มหาชน),1/30/23,2023-01-30T00:00:00.000Z,2023,1,30,,100%Mandarin Orange Malee 200ml 3x8 Leaf,,BRI,,105.0,Fruit Juice,Orange-Mandarin,3*8,200 ml
7 - Eleven,ศูนย์กระจายสินค้าขอนแก่น (W801),1/31/23,2023-01-31T00:00:00.000Z,2023,1,31,,100%Mandarin Orange Malee 200ml 3x8 Leaf,,BRI,,63.0,Fruit Juice,Orange-Mandarin,3*8,200 ml
7 - Eleven,ศูนย์กระจายสินค้า RDCชลบุรีใหม่ W121,1/31/23,2023-01-31T00:00:00.000Z,2023,1,31,,100%Mandarin Orange Malee 200ml 3x8 Leaf,,BRI,,63.0,Fruit Juice,Orange-Mandarin,3*8,200 ml
7 - Eleven,ศูนย์กระจายสินค้า RDC WESTมหาชัย,1/31/23,2023-01-31T00:00:00.000Z,2023,1,31,,100%Mandarin Orange Malee 200ml 3x8 Leaf,,BRI,,63.0,Fruit Juice,Orange-Mandarin,3*8,200 ml
7 - Eleven,ศูนย์กระจายสินค้า DC5 สุวรรณภูมิ,1/31/23,2023-01-31T00:00:00.000Z,2023,1,31,,100%Mandarin Orange Malee 200ml 3x8 Leaf,,BRI,,84.0,Fruit Juice,Orange-Mandarin,3*8,200 ml
7 - Eleven,ศุนย์กระจายสินค้า นครสวรรค์(RDC นครสวรรค์),1/31/23,2023-01-31T00:00:00.000Z,2023,1,31,,100%Mandarin Orange Malee 200ml 3x8 Leaf,,BRI,,147.0,Fruit Juice,Orange-Mandarin,3*8,200 ml
7 - Eleven,บริษัท ซีพี ออลล์ จำกัด (มหาชน),1/31/23,2023-01-31T00:00:00.000Z,2023,1,31,,100%Mandarin Orange Malee 200ml 3x8 Leaf,,BRI,,224.0,Fruit Juice,Orange-Mandarin,3*8,200 ml
7 - Eleven,ศูนย์กระจายสินค้า RDCชลบุรีใหม่ W121,2/1/23,2023-02-01T00:00:00.000Z,2023,2,1,,100%Mandarin Orange Malee 200ml 3x8 Leaf,,BRI,,63.0,Fruit Juice,Orange-Mandarin,3*8,200 ml
7 - Eleven,ศูนย์กระจายสินค้า RDC สุราษฏร์ธานี,2/1/23,2023-02-01T00:00:00.000Z,2023,2,1,,100%Mandarin Orange Malee 200ml 3x8 Leaf,,BRI,,147.0,Fruit Juice,Orange-Mandarin,3*8,200 ml
7 - Eleven,ศูนย์กระจายสินค้า RDC WESTมหาชัย,2/1/23,2023-02-01T00:00:00.000Z,2023,2,1,,100%Mandarin Orange Malee 200ml 3x8 Leaf,,BRI,,42.0,Fruit Juice,Orange-Mandarin,3*8,200 ml
7 - Eleven,ศุนย์กระจายสินค้า หาดใหญ่(RDC หาดใหญ่),2/1/23,2023-02-01T00:00:00.000Z,2023,2,1,,100%Mandarin Orange Malee 200ml 3x8 Leaf,,BRI,,105.0,Fruit Juice,Orange-Mandarin,3*8,200 ml
7 - Eleven,ศูนย์กระจายสินค้าขอนแก่น (W801),2/2/23,2023-02-02T00:00:00.000Z,2023,2,2,,100%Mandarin Orange Malee 200ml 3x8 Leaf,,BRI,,42.0,Fruit Juice,Orange-Mandarin,3*8,200 ml
7 - Eleven,ศูนย์กระจายสินค้า RDCชลบุรีใหม่ W121,2/2/23,2023-02-02T00:00:00.000Z,2023,2,2,,100%Mandarin Orange Malee 200ml 3x8 Leaf,,BRI,,84.0,Fruit Juice,Orange-Mandarin,3*8,200 ml
7 - Eleven,ศูนย์กระจายสินค้า RDC WESTมหาชัย,2/2/23,2023-02-02T00:00:00.000Z,2023,2,2,,100%Mandarin Orange Malee 200ml 3x8 Leaf,,BRI,,105.0,Fruit Juice,Orange-Mandarin,3*8,200 ml
7 - Eleven,ศูนย์กระจายสินค้า DC5 สุวรรณภูมิ,2/2/23,2023-02-02T00:00:00.000Z,2023,2,2,,100%Mandarin Orange Malee 200ml 3x8 Leaf,,BRI,,210.0,Fruit Juice,Orange-Mandarin,3*8,200 ml
7 - Eleven,ศุนย์กระจายสินค้า นครสวรรค์(RDC นครสวรรค์),2/2/23,2023-02-02T00:00:00.000Z,2023,2,2,,100%Mandarin Orange Malee 200ml 3x8 Leaf,,BRI,,105.0,Fruit Juice,Orange-Mandarin,3*8,200 ml
7 - Eleven,บริษัท ซีพี ออลล์ จำกัด (มหาชน),2/2/23,2023-02-02T00:00:00.000Z,2023,2,2,,100%Mandarin Orange Malee 200ml 3x8 Leaf,,BRI,,495.0,Fruit Juice,Orange-Mandarin,3*8,200 ml
7 - Eleven,ศูนย์กระจายสินค้า RDCชลบุรีใหม่ W121,2/3/23,2023-02-03T00:00:00.000Z,2023,2,3,,100%Mandarin Orange Malee 200ml 3x8 Leaf,,BRI,,126.0,Fruit Juice,Orange-Mandarin,3*8,200 ml
7 - Eleven,ศูนย์กระจายสินค้า RDC WESTมหาชัย,2/3/23,2023-02-03T00:00:00.000Z,2023,2,3,,100%Mandarin Orange Malee 200ml 3x8 Leaf,,BRI,,105.0,Fruit Juice,Orange-Mandarin,3*8,200 ml
7 - Eleven,ศูนย์กระจายสินค้า DC5 สุวรรณภูมิ,2/3/23,2023-02-03T00:00:00.000Z,2023,2,3,,100%Mandarin Orange Malee 200ml 3x8 Leaf,,BRI,,168.0,Fruit Juice,Orange-Mandarin,3*8,200 ml
7 - Eleven,ศูนย์กระจายสินค้าขอนแก่น (W801),2/4/23,2023-02-04T00:00:00.000Z,2023,2,4,,100%Mandarin Orange Malee 200ml 3x8 Leaf,,BRI,,42.0,Fruit Juice,Orange-Mandarin,3*8,200 ml
7 - Eleven,ศูนย์กระจายสินค้า RDCชลบุรีใหม่ W121,2/4/23,2023-02-04T00:00:00.000Z,2023,2,4,,100%Mandarin Orange Malee 200ml 3x8 Leaf,,BRI,,126.0,Fruit Juice,Orange-Mandarin,3*8,200 ml
7 - Eleven,ศูนย์กระจายสินค้า RDC สุราษฏร์ธานี,2/4/23,2023-02-04T00:00:00.000Z,2023,2,4,,100%Mandarin Orange Malee 200ml 3x8 Leaf,,BRI,,189.0,Fruit Juice,Orange-Mandarin,3*8,200 ml
7 - Eleven,ศูนย์กระจายสินค้า RDC WESTมหาชัย,2/4/23,2023-02-04T00:00:00.000Z,2023,2,4,,100%Mandarin Orange Malee 200ml 3x8 Leaf,,BRI,,105.0,Fruit Juice,Orange-Mandarin,3*8,200 ml
7 - Eleven,ศูนย์กระจายสินค้า DC5 สุวรรณภูมิ,2/4/23,2023-02-04T00:00:00.000Z,2023,2,4,,100%Mandarin Orange Malee 200ml 3x8 Leaf,,BRI,,168.0,Fruit Juice,Orange-Mandarin,3*8,200 ml
7 - Eleven,ศุนย์กระจายสินค้า หาดใหญ่(RDC หาดใหญ่),2/4/23,2023-02-04T00:00:00.000Z,2023,2,4,,100%Mandarin Orange Malee 200ml 3x8 Leaf,,BRI,,21.0,Fruit Juice,Orange-Mandarin,3*8,200 ml
7 - Eleven,ศุนย์กระจายสินค้า นครสวรรค์(RDC นครสวรรค์),2/4/23,2023-02-04T00:00:00.000Z,2023,2,4,,100%Mandarin Orange Malee 200ml 3x8 Leaf,,BRI,,63.0,Fruit Juice,Orange-Mandarin,3*8,200 ml
7 - Eleven,บริษัท ซีพี ออลล์ จำกัด (มหาชน),2/4/23,2023-02-04T00:00:00.000Z,2023,2,4,,100%Mandarin Orange Malee 200ml 3x8 Leaf,,BRI,,184.0,Fruit Juice,Orange-Mandarin,3*8,200 ml
7 - Eleven,ศูนย์กระจายสินค้า RDC WESTมหาชัย,2/6/23,2023-02-06T00:00:00.000Z,2023,2,6,,100%Mandarin Orange Malee 200ml 3x8 Leaf,,BRI,,84.0,Fruit Juice,Orange-Mandarin,3*8,200 ml
7 - Eleven,บริษัท ซีพี ออลล์ จำกัด (มหาชน),2/6/23,2023-02-06T00:00:00.000Z,2023,2,6,,100%Mandarin Orange Malee 200ml 3x8 Leaf,,BRI,,291.0,Fruit Juice,Orange-Mandarin,3*8,200 ml
7 - Eleven,ศูนย์กระจายสินค้าขอนแก่น (W801),2/7/23,2023-02-07T00:00:00.000Z,2023,2,7,,100%Mandarin Orange Malee 200ml 3x8 Leaf,,BRI,,126.0,Fruit Juice,Orange-Mandarin,3*8,200 ml
7 - Eleven,ศูนย์กระจายสินค้า RDCชลบุรีใหม่ W121,2/7/23,2023-02-07T00:00:00.000Z,2023,2,7,,100%Mandarin Orange Malee 200ml 3x8 Leaf,,BRI,,63.0,Fruit Juice,Orange-Mandarin,3*8,200 ml
7 - Eleven,ศูนย์กระจายสินค้า RDC WESTมหาชัย,2/7/23,2023-02-07T00:00:00.000Z,2023,2,7,,100%Mandarin Orange Malee 200ml 3x8 Leaf,,BRI,,63.0,Fruit Juice,Orange-Mandarin,3*8,200 ml
7 - Eleven,ศูนย์กระจายสินค้า DC5 สุวรรณภูมิ,2/7/23,2023-02-07T00:00:00.000Z,2023,2,7,,100%Mandarin Orange Malee 200ml 3x8 Leaf,,BRI,,168.0,Fruit Juice,Orange-Mandarin,3*8,200 ml
7 - Eleven,ศุนย์กระจายสินค้า นครสวรรค์(RDC นครสวรรค์),2/7/23,2023-02-07T00:00:00.000Z,2023,2,7,,100%Mandarin Orange Malee 200ml 3x8 Leaf,,BRI,,147.0,Fruit Juice,Orange-Mandarin,3*8,200 ml
7 - Eleven,บริษัท ซีพี ออลล์ จำกัด (มหาชน),2/7/23,2023-02-07T00:00:00.000Z,2023,2,7,,100%Mandarin Orange Malee 200ml 3x8 Leaf,,BRI,,204.0,Fruit Juice,Orange-Mandarin,3*8,200 ml
7 - Eleven,ศูนย์กระจายสินค้า RDCชลบุรีใหม่ W121,2/8/23,2023-02-08T00:00:00.000Z,2023,2,8,,100%Mandarin Orange Malee 200ml 3x8 Leaf,,BRI,,84.0,Fruit Juice,Orange-Mandarin,3*8,200 ml
7 - Eleven,ศูนย์กระจายสินค้า RDC สุราษฏร์ธานี,2/8/23,2023-02-08T00:00:00.000Z,2023,2,8,,100%Mandarin Orange Malee 200ml 3x8 Leaf,,BRI,,294.0,Fruit Juice,Orange-Mandarin,3*8,200 ml
7 - Eleven,ศูนย์กระจายสินค้า RDC WESTมหาชัย,2/8/23,2023-02-08T00:00:00.000Z,2023,2,8,,100%Mandarin Orange Malee 200ml 3x8 Leaf,,BRI,,63.0,Fruit Juice,Orange-Mandarin,3*8,200 ml
7 - Eleven,ศูนย์กระจายสินค้า DC5 สุวรรณภูมิ,2/8/23,2023-02-08T00:00:00.000Z,2023,2,8,,100%Mandarin Orange Malee 200ml 3x8 Leaf,,BRI,,105.0,Fruit Juice,Orange-Mandarin,3*8,200 ml
7 - Eleven,ศุนย์กระจายสินค้า หาดใหญ่(RDC หาดใหญ่),2/8/23,2023-02-08T00:00:00.000Z,2023,2,8,,100%Mandarin Orange Malee 200ml 3x8 Leaf,,BRI,,105.0,Fruit Juice,Orange-Mandarin,3*8,200 ml
7 - Eleven,ศูนย์กระจายสินค้าขอนแก่น (W801),2/9/23,2023-02-09T00:00:00.000Z,2023,2,9,,100%Mandarin Orange Malee 200ml 3x8 Leaf,,BRI,,84.0,Fruit Juice,Orange-Mandarin,3*8,200 ml
7 - Eleven,ศูนย์กระจายสินค้า RDCชลบุรีใหม่ W121,2/9/23,2023-02-09T00:00:00.000Z,2023,2,9,,100%Mandarin Orange Malee 200ml 3x8 Leaf,,BRI,,84.0,Fruit Juice,Orange-Mandarin,3*8,200 ml
7 - Eleven,ศูนย์กระจายสินค้า RDC WESTมหาชัย,2/9/23,2023-02-09T00:00:00.000Z,2023,2,9,,100%Mandarin Orange Malee 200ml 3x8 Leaf,,BRI,,42.0,Fruit Juice,Orange-Mandarin,3*8,200 ml
7 - Eleven,ศูนย์กระจายสินค้า DC5 สุวรรณภูมิ,2/9/23,2023-02-09T00:00:00.000Z,2023,2,9,,100%Mandarin Orange Malee 200ml 3x8 Leaf,,BRI,,84.0,Fruit Juice,Orange-Mandarin,3*8,200 ml
7 - Eleven,ศุนย์กระจายสินค้า นครสวรรค์(RDC นครสวรรค์),2/9/23,2023-02-09T00:00:00.000Z,2023,2,9,,100%Mandarin Orange Malee 200ml 3x8 Leaf,,BRI,,63.0,Fruit Juice,Orange-Mandarin,3*8,200 ml
7 - Eleven,บริษัท ซีพี ออลล์ จำกัด (มหาชน),2/9/23,2023-02-09T00:00:00.000Z,2023,2,9,,100%Mandarin Orange Malee 200ml 3x8 Leaf,,BRI,,308.0,Fruit Juice,Orange-Mandarin,3*8,200 ml
7 - Eleven,ศูนย์กระจายสินค้า DC5 สุวรรณภูมิ,2/10/23,2023-02-10T00:00:00.000Z,2023,2,10,,100%Mandarin Orange Malee 200ml 3x8 Leaf,,BRI,,63.0,Fruit Juice,Orange-Mandarin,3*8,200 ml
7 - Eleven,ศูนย์กระจายสินค้าขอนแก่น (W801),2/11/23,2023-02-11T00:00:00.000Z,2023,2,11,,100%Mandarin Orange Malee 200ml 3x8 Leaf,,BRI,,63.0,Fruit Juice,Orange-Mandarin,3*8,200 ml
7 - Eleven,ศูนย์กระจายสินค้า RDCชลบุรีใหม่ W121,2/11/23,2023-02-11T00:00:00.000Z,2023,2,11,,100%Mandarin Orange Malee 200ml 3x8 Leaf,,BRI,,168.0,Fruit Juice,Orange-Mandarin,3*8,200 ml
7 - Eleven,ศูนย์กระจายสินค้า RDC สุราษฏร์ธานี,2/11/23,2023-02-11T00:00:00.000Z,2023,2,11,,100%Mandarin Orange Malee 200ml 3x8 Leaf,,BRI,,84.0,Fruit Juice,Orange-Mandarin,3*8,200 ml
7 - Eleven,ศูนย์กระจายสินค้า RDC WESTมหาชัย,2/11/23,2023-02-11T00:00:00.000Z,2023,2,11,,100%Mandarin Orange Malee 200ml 3x8 Leaf,,BRI,,126.0,Fruit Juice,Orange-Mandarin,3*8,200 ml
7 - Eleven,ศูนย์กระจายสินค้า DC5 สุวรรณภูมิ,2/11/23,2023-02-11T00:00:00.000Z,2023,2,11,,100%Mandarin Orange Malee 200ml 3x8 Leaf,,BRI,,168.0,Fruit Juice,Orange-Mandarin,3*8,200 ml
7 - Eleven,ศุนย์กระจายสินค้า หาดใหญ่(RDC หาดใหญ่),2/11/23,2023-02-11T00:00:00.000Z,2023,2,11,,100%Mandarin Orange Malee 200ml 3x8 Leaf,,BRI,,21.0,Fruit Juice,Orange-Mandarin,3*8,200 ml
7 - Eleven,ศุนย์กระจายสินค้า นครสวรรค์(RDC นครสวรรค์),2/11/23,2023-02-11T00:00:00.000Z,2023,2,11,,100%Mandarin Orange Malee 200ml 3x8 Leaf,,BRI,,21.0,Fruit Juice,Orange-Mandarin,3*8,200 ml
7 - Eleven,บริษัท ซีพี ออลล์ จำกัด (มหาชน),2/11/23,2023-02-11T00:00:00.000Z,2023,2,11,,100%Mandarin Orange Malee 200ml 3x8 Leaf,,BRI,,184.0,Fruit Juice,Orange-Mandarin,3*8,200 ml
7 - Eleven,ศูนย์กระจายสินค้า RDCชลบุรีใหม่ W121,2/13/23,2023-02-13T00:00:00.000Z,2023,2,13,,100%Mandarin Orange Malee 200ml 3x8 Leaf,,BRI,,84.0,Fruit Juice,Orange-Mandarin,3*8,200 ml
7 - Eleven,ศูนย์กระจายสินค้า RDC WESTมหาชัย,2/13/23,2023-02-13T00:00:00.000Z,2023,2,13,,100%Mandarin Orange Malee 200ml 3x8 Leaf,,BRI,,84.0,Fruit Juice,Orange-Mandarin,3*8,200 ml
7 - Eleven,ศูนย์กระจายสินค้า DC5 สุวรรณภูมิ,2/13/23,2023-02-13T00:00:00.000Z,2023,2,13,,100%Mandarin Orange Malee 200ml 3x8 Leaf,,BRI,,105.0,Fruit Juice,Orange-Mandarin,3*8,200 ml
7 - Eleven,บริษัท ซีพี ออลล์ จำกัด (มหาชน),2/13/23,2023-02-13T00:00:00.000Z,2023,2,13,,100%Mandarin Orange Malee 200ml 3x8 Leaf,,BRI,,291.0,Fruit Juice,Orange-Mandarin,3*8,200 ml
7 - Eleven,ศูนย์กระจายสินค้าขอนแก่น (W801),2/14/23,2023-02-14T00:00:00.000Z,2023,2,14,,100%Mandarin Orange Malee 200ml 3x8 Leaf,,BRI,,126.0,Fruit Juice,Orange-Mandarin,3*8,200 ml
7 - Eleven,ศูนย์กระจายสินค้า RDCชลบุรีใหม่ W121,2/14/23,2023-02-14T00:00:00.000Z,2023,2,14,,100%Mandarin Orange Malee 200ml 3x8 Leaf,,BRI,,42.0,Fruit Juice,Orange-Mandarin,3*8,200 ml
7 - Eleven,ศูนย์กระจายสินค้า RDC WESTมหาชัย,2/14/23,2023-02-14T00:00:00.000Z,2023,2,14,,100%Mandarin Orange Malee 200ml 3x8 Leaf,,BRI,,63.0,Fruit Juice,Orange-Mandarin,3*8,200 ml
7 - Eleven,ศูนย์กระจายสินค้า DC5 สุวรรณภูมิ,2/14/23,2023-02-14T00:00:00.000Z,2023,2,14,,100%Mandarin Orange Malee 200ml 3x8 Leaf,,BRI,,105.0,Fruit Juice,Orange-Mandarin,3*8,200 ml
7 - Eleven,ศุนย์กระจายสินค้า นครสวรรค์(RDC นครสวรรค์),2/14/23,2023-02-14T00:00:00.000Z,2023,2,14,,100%Mandarin Orange Malee 200ml 3x8 Leaf,,BRI,,147.0,Fruit Juice,Orange-Mandarin,3*8,200 ml
7 - Eleven,บริษัท ซีพี ออลล์ จำกัด (มหาชน),2/14/23,2023-02-14T00:00:00.000Z,2023,2,14,,100%Mandarin Orange Malee 200ml 3x8 Leaf,,BRI,,304.0,Fruit Juice,Orange-Mandarin,3*8,200 ml
7 - Eleven,ศูนย์กระจายสินค้า RDC สุราษฏร์ธานี,2/15/23,2023-02-15T00:00:00.000Z,2023,2,15,,100%Mandarin Orange Malee 200ml 3x8 Leaf,,BRI,,168.0,Fruit Juice,Orange-Mandarin,3*8,200 ml
7 - Eleven,ศูนย์กระจายสินค้า RDC WESTมหาชัย,2/15/23,2023-02-15T00:00:00.000Z,2023,2,15,,100%Mandarin Orange Malee 200ml 3x8 Leaf,,BRI,,63.0,Fruit Juice,Orange-Mandarin,3*8,200 ml
7 - Eleven,ศูนย์กระจายสินค้า DC5 สุวรรณภูมิ,2/15/23,2023-02-15T00:00:00.000Z,2023,2,15,,100%Mandarin Orange Malee 200ml 3x8 Leaf,,BRI,,105.0,Fruit Juice,Orange-Mandarin,3*8,200 ml
7 - Eleven,ศุนย์กระจายสินค้า หาดใหญ่(RDC หาดใหญ่),2/15/23,2023-02-15T00:00:00.000Z,2023,2,15,,100%Mandarin Orange Malee 200ml 3x8 Leaf,,BRI,,100.0,Fruit Juice,Orange-Mandarin,3*8,200 ml
7 - Eleven,บริษัท ซีพี ออลล์ จำกัด (มหาชน),2/15/23,2023-02-15T00:00:00.000Z,2023,2,15,,100%Mandarin Orange Malee 200ml 3x8 Leaf,,BRI,,144.0,Fruit Juice,Orange-Mandarin,3*8,200 ml
7 - Eleven,ศูนย์กระจายสินค้าขอนแก่น (W801),2/16/23,2023-02-16T00:00:00.000Z,2023,2,16,,100%Mandarin Orange Malee 200ml 3x8 Leaf,,BRI,,84.0,Fruit Juice,Orange-Mandarin,3*8,200 ml
7 - Eleven,ศูนย์กระจายสินค้า RDCชลบุรีใหม่ W121,2/16/23,2023-02-16T00:00:00.000Z,2023,2,16,,100%Mandarin Orange Malee 200ml 3x8 Leaf,,BRI,,63.0,Fruit Juice,Orange-Mandarin,3*8,200 ml
7 - Eleven,ศูนย์กระจายสินค้า RDC WESTมหาชัย,2/16/23,2023-02-16T00:00:00.000Z,2023,2,16,,100%Mandarin Orange Malee 200ml 3x8 Leaf,,BRI,,63.0,Fruit Juice,Orange-Mandarin,3*8,200 ml
7 - Eleven,ศูนย์กระจายสินค้า DC5 สุวรรณภูมิ,2/16/23,2023-02-16T00:00:00.000Z,2023,2,16,,100%Mandarin Orange Malee 200ml 3x8 Leaf,,BRI,,84.0,Fruit Juice,Orange-Mandarin,3*8,200 ml
7 - Eleven,ศุนย์กระจายสินค้า นครสวรรค์(RDC นครสวรรค์),2/16/23,2023-02-16T00:00:00.000Z,2023,2,16,,100%Mandarin Orange Malee 200ml 3x8 Leaf,,BRI,,63.0,Fruit Juice,Orange-Mandarin,3*8,200 ml
7 - Eleven,บริษัท ซีพี ออลล์ จำกัด (มหาชน),2/16/23,2023-02-16T00:00:00.000Z,2023,2,16,,100%Mandarin Orange Malee 200ml 3x8 Leaf,,BRI,,102.0,Fruit Juice,Orange-Mandarin,3*8,200 ml
7 - Eleven,ศูนย์กระจายสินค้า RDCชลบุรีใหม่ W121,2/17/23,2023-02-17T00:00:00.000Z,2023,2,17,,100%Mandarin Orange Malee 200ml 3x8 Leaf,,BRI,,84.0,Fruit Juice,Orange-Mandarin,3*8,200 ml
7 - Eleven,ศูนย์กระจายสินค้า RDC WESTมหาชัย,2/17/23,2023-02-17T00:00:00.000Z,2023,2,17,,100%Mandarin Orange Malee 200ml 3x8 Leaf,,BRI,,63.0,Fruit Juice,Orange-Mandarin,3*8,200 ml
7 - Eleven,ศูนย์กระจายสินค้า DC5 สุวรรณภูมิ,2/17/23,2023-02-17T00:00:00.000Z,2023,2,17,,100%Mandarin Orange Malee 200ml 3x8 Leaf,,BRI,,63.0,Fruit Juice,Orange-Mandarin,3*8,200 ml
7 - Eleven,บริษัท ซีพี ออลล์ จำกัด (มหาชน),2/17/23,2023-02-17T00:00:00.000Z,2023,2,17,,100%Mandarin Orange Malee 200ml 3x8 Leaf,,BRI,,144.0,Fruit Juice,Orange-Mandarin,3*8,200 ml
7 - Eleven,ศูนย์กระจายสินค้าขอนแก่น (W801),2/18/23,2023-02-18T00:00:00.000Z,2023,2,18,,100%Mandarin Orange Malee 200ml 3x8 Leaf,,BRI,,42.0,Fruit Juice,Orange-Mandarin,3*8,200 ml
7 - Eleven,ศูนย์กระจายสินค้า RDCชลบุรีใหม่ W121,2/18/23,2023-02-18T00:00:00.000Z,2023,2,18,,100%Mandarin Orange Malee 200ml 3x8 Leaf,,BRI,,105.0,Fruit Juice,Orange-Mandarin,3*8,200 ml
7 - Eleven,ศูนย์กระจายสินค้า RDC สุราษฏร์ธานี,2/18/23,2023-02-18T00:00:00.000Z,2023,2,18,,100%Mandarin Orange Malee 200ml 3x8 Leaf,,BRI,,84.0,Fruit Juice,Orange-Mandarin,3*8,200 ml
7 - Eleven,ศูนย์กระจายสินค้า DC5 สุวรรณภูมิ,2/18/23,2023-02-18T00:00:00.000Z,2023,2,18,,100%Mandarin Orange Malee 200ml 3x8 Leaf,,BRI,,168.0,Fruit Juice,Orange-Mandarin,3*8,200 ml
7 - Eleven,ศุนย์กระจายสินค้า หาดใหญ่(RDC หาดใหญ่),2/18/23,2023-02-18T00:00:00.000Z,2023,2,18,,100%Mandarin Orange Malee 200ml 3x8 Leaf,,BRI,,42.0,Fruit Juice,Orange-Mandarin,3*8,200 ml
7 - Eleven,ศุนย์กระจายสินค้า นครสวรรค์(RDC นครสวรรค์),2/18/23,2023-02-18T00:00:00.000Z,2023,2,18,,100%Mandarin Orange Malee 200ml 3x8 Leaf,,BRI,,63.0,Fruit Juice,Orange-Mandarin,3*8,200 ml
7 - Eleven,บริษัท ซีพี ออลล์ จำกัด (มหาชน),2/18/23,2023-02-18T00:00:00.000Z,2023,2,18,,100%Mandarin Orange Malee 200ml 3x8 Leaf,,BRI,,60.0,Fruit Juice,Orange-Mandarin,3*8,200 ml
7 - Eleven,ศูนย์กระจายสินค้า RDCชลบุรีใหม่ W121,2/20/23,2023-02-20T00:00:00.000Z,2023,2,20,,100%Mandarin Orange Malee 200ml 3x8 Leaf,,BRI,,126.0,Fruit Juice,Orange-Mandarin,3*8,200 ml
7 - Eleven,ศูนย์กระจายสินค้า DC5 สุวรรณภูมิ,2/20/23,2023-02-20T00:00:00.000Z,2023,2,20,,100%Mandarin Orange Malee 200ml 3x8 Leaf,,BRI,,63.0,Fruit Juice,Orange-Mandarin,3*8,200 ml
7 - Eleven,บริษัท ซีพี ออลล์ จำกัด (มหาชน),2/20/23,2023-02-20T00:00:00.000Z,2023,2,20,,100%Mandarin Orange Malee 200ml 3x8 Leaf,,BRI,,333.0,Fruit Juice,Orange-Mandarin,3*8,200 ml
7 - Eleven,ศูนย์กระจายสินค้าขอนแก่น (W801),2/21/23,2023-02-21T00:00:00.000Z,2023,2,21,,100%Mandarin Orange Malee 200ml 3x8 Leaf,,BRI,,126.0,Fruit Juice,Orange-Mandarin,3*8,200 ml
7 - Eleven,ศูนย์กระจายสินค้า RDCชลบุรีใหม่ W121,2/21/23,2023-02-21T00:00:00.000Z,2023,2,21,,100%Mandarin Orange Malee 200ml 3x8 Leaf,,BRI,,63.0,Fruit Juice,Orange-Mandarin,3*8,200 ml
7 - Eleven,ศูนย์กระจายสินค้า RDC WESTมหาชัย,2/21/23,2023-02-21T00:00:00.000Z,2023,2,21,,100%Mandarin Orange Malee 200ml 3x8 Leaf,,BRI,,336.0,Fruit Juice,Orange-Mandarin,3*8,200 ml
7 - Eleven,ศูนย์กระจายสินค้า DC5 สุวรรณภูมิ,2/21/23,2023-02-21T00:00:00.000Z,2023,2,21,,100%Mandarin Orange Malee 200ml 3x8 Leaf,,BRI,,84.0,Fruit Juice,Orange-Mandarin,3*8,200 ml
7 - Eleven,ศุนย์กระจายสินค้า นครสวรรค์(RDC นครสวรรค์),2/21/23,2023-02-21T00:00:00.000Z,2023,2,21,,100%Mandarin Orange Malee 200ml 3x8 Leaf,,BRI,,147.0,Fruit Juice,Orange-Mandarin,3*8,200 ml
7 - Eleven,บริษัท ซีพี ออลล์ จำกัด (มหาชน),2/21/23,2023-02-21T00:00:00.000Z,2023,2,21,,100%Mandarin Orange Malee 200ml 3x8 Leaf,,BRI,,224.0,Fruit Juice,Orange-Mandarin,3*8,200 ml
7 - Eleven,ศูนย์กระจายสินค้า RDCชลบุรีใหม่ W121,2/22/23,2023-02-22T00:00:00.000Z,2023,2,22,,100%Mandarin Orange Malee 200ml 3x8 Leaf,,BRI,,42.0,Fruit Juice,Orange-Mandarin,3*8,200 ml
7 - Eleven,ศูนย์กระจายสินค้า RDC สุราษฏร์ธานี,2/22/23,2023-02-22T00:00:00.000Z,2023,2,22,,100%Mandarin Orange Malee 200ml 3x8 Leaf,,BRI,,252.0,Fruit Juice,Orange-Mandarin,3*8,200 ml
7 - Eleven,ศูนย์กระจายสินค้า DC5 สุวรรณภูมิ,2/22/23,2023-02-22T00:00:00.000Z,2023,2,22,,100%Mandarin Orange Malee 200ml 3x8 Leaf,,BRI,,84.0,Fruit Juice,Orange-Mandarin,3*8,200 ml
7 - Eleven,ศุนย์กระจายสินค้า หาดใหญ่(RDC หาดใหญ่),2/22/23,2023-02-22T00:00:00.000Z,2023,2,22,,100%Mandarin Orange Malee 200ml 3x8 Leaf,,BRI,,83.0,Fruit Juice,Orange-Mandarin,3*8,200 ml
7 - Eleven,บริษัท ซีพี ออลล์ จำกัด (มหาชน),2/22/23,2023-02-22T00:00:00.000Z,2023,2,22,,100%Mandarin Orange Malee 200ml 3x8 Leaf,,BRI,,144.0,Fruit Juice,Orange-Mandarin,3*8,200 ml
7 - Eleven,ศูนย์กระจายสินค้าขอนแก่น (W801),2/23/23,2023-02-23T00:00:00.000Z,2023,2,23,,100%Mandarin Orange Malee 200ml 3x8 Leaf,,BRI,,63.0,Fruit Juice,Orange-Mandarin,3*8,200 ml
7 - Eleven,ศูนย์กระจายสินค้า RDCชลบุรีใหม่ W121,2/23/23,2023-02-23T00:00:00.000Z,2023,2,23,,100%Mandarin Orange Malee 200ml 3x8 Leaf,,BRI,,42.0,Fruit Juice,Orange-Mandarin,3*8,200 ml
7 - Eleven,ศูนย์กระจายสินค้า RDC WESTมหาชัย,2/23/23,2023-02-23T00:00:00.000Z,2023,2,23,,100%Mandarin Orange Malee 200ml 3x8 Leaf,,BRI,,63.0,Fruit Juice,Orange-Mandarin,3*8,200 ml
7 - Eleven,ศูนย์กระจายสินค้า DC5 สุวรรณภูมิ,2/23/23,2023-02-23T00:00:00.000Z,2023,2,23,,100%Mandarin Orange Malee 200ml 3x8 Leaf,,BRI,,168.0,Fruit Juice,Orange-Mandarin,3*8,200 ml
7 - Eleven,ศุนย์กระจายสินค้า นครสวรรค์(RDC นครสวรรค์),2/23/23,2023-02-23T00:00:00.000Z,2023,2,23,,100%Mandarin Orange Malee 200ml 3x8 Leaf,,BRI,,84.0,Fruit Juice,Orange-Mandarin,3*8,200 ml
7 - Eleven,บริษัท ซีพี ออลล์ จำกัด (มหาชน),2/23/23,2023-02-23T00:00:00.000Z,2023,2,23,,100%Mandarin Orange Malee 200ml 3x8 Leaf,,BRI,,257.0,Fruit Juice,Orange-Mandarin,3*8,200 ml
7 - Eleven,บริษัท ซีพี ออลล์ จำกัด (มหาชน),2/24/23,2023-02-24T00:00:00.000Z,2023,2,24,,100%Mandarin Orange Malee 200ml 3x8 Leaf,,BRI,,144.0,Fruit Juice,Orange-Mandarin,3*8,200 ml
7 - Eleven,ศูนย์กระจายสินค้าขอนแก่น (W801),2/25/23,2023-02-25T00:00:00.000Z,2023,2,25,,100%Mandarin Orange Malee 200ml 3x8 Leaf,,BRI,,1176.0,Fruit Juice,Orange-Mandarin,3*8,200 ml
7 - Eleven,ศูนย์กระจายสินค้า RDCชลบุรีใหม่ W121,2/25/23,2023-02-25T00:00:00.000Z,2023,2,25,,100%Mandarin Orange Malee 200ml 3x8 Leaf,,BRI,,168.0,Fruit Juice,Orange-Mandarin,3*8,200 ml
7 - Eleven,ศูนย์กระจายสินค้า RDC สุราษฏร์ธานี,2/25/23,2023-02-25T00:00:00.000Z,2023,2,25,,100%Mandarin Orange Malee 200ml 3x8 Leaf,,BRI,,840.0,Fruit Juice,Orange-Mandarin,3*8,200 ml
7 - Eleven,ศูนย์กระจายสินค้า RDC WESTมหาชัย,2/25/23,2023-02-25T00:00:00.000Z,2023,2,25,,100%Mandarin Orange Malee 200ml 3x8 Leaf,,BRI,,168.0,Fruit Juice,Orange-Mandarin,3*8,200 ml
7 - Eleven,ศูนย์กระจายสินค้า DC5 สุวรรณภูมิ,2/25/23,2023-02-25T00:00:00.000Z,2023,2,25,,100%Mandarin Orange Malee 200ml 3x8 Leaf,,BRI,,168.0,Fruit Juice,Orange-Mandarin,3*8,200 ml
7 - Eleven,ศุนย์กระจายสินค้า หาดใหญ่(RDC หาดใหญ่),2/25/23,2023-02-25T00:00:00.000Z,2023,2,25,,100%Mandarin Orange Malee 200ml 3x8 Leaf,,BRI,,693.0,Fruit Juice,Orange-Mandarin,3*8,200 ml
7 - Eleven,ศุนย์กระจายสินค้า นครสวรรค์(RDC นครสวรรค์),2/25/23,2023-02-25T00:00:00.000Z,2023,2,25,,100%Mandarin Orange Malee 200ml 3x8 Leaf,,BRI,,1239.0,Fruit Juice,Orange-Mandarin,3*8,200 ml
7 - Eleven,บริษัท ซีพี ออลล์ จำกัด (มหาชน),2/25/23,2023-02-25T00:00:00.000Z,2023,2,25,,100%Mandarin Orange Malee 200ml 3x8 Leaf,,BRI,,1120.0,Fruit Juice,Orange-Mandarin,3*8,200 ml
7 - Eleven,ศูนย์กระจายสินค้า RDC WESTมหาชัย,2/27/23,2023-02-27T00:00:00.000Z,2023,2,27,,100%Mandarin Orange Malee 200ml 3x8 Leaf,,BRI,,2184.0,Fruit Juice,Orange-Mandarin,3*8,200 ml
7 - Eleven,ศูนย์กระจายสินค้าขอนแก่น (W801),2/28/23,2023-02-28T00:00:00.000Z,2023,2,28,,100%Mandarin Orange Malee 200ml 3x8 Leaf,,BRI,,168.0,Fruit Juice,Orange-Mandarin,3*8,200 ml
7 - Eleven,ศูนย์กระจายสินค้า RDCชลบุรีใหม่ W121,2/28/23,2023-02-28T00:00:00.000Z,2023,2,28,,100%Mandarin Orange Malee 200ml 3x8 Leaf,,BRI,,1512.0,Fruit Juice,Orange-Mandarin,3*8,200 ml
7 - Eleven,ศูนย์กระจายสินค้า DC5 สุวรรณภูมิ,2/28/23,2023-02-28T00:00:00.000Z,2023,2,28,,100%Mandarin Orange Malee 200ml 3x8 Leaf,,BRI,,2688.0,Fruit Juice,Orange-Mandarin,3*8,200 ml
7 - Eleven,ศุนย์กระจายสินค้า นครสวรรค์(RDC นครสวรรค์),2/28/23,2023-02-28T00:00:00.000Z,2023,2,28,,100%Mandarin Orange Malee 200ml 3x8 Leaf,,BRI,,147.0,Fruit Juice,Orange-Mandarin,3*8,200 ml
7 - Eleven,บริษัท ซีพี ออลล์ จำกัด (มหาชน),2/28/23,2023-02-28T00:00:00.000Z,2023,2,28,,100%Mandarin Orange Malee 200ml 3x8 Leaf,,BRI,,1323.0,Fruit Juice,Orange-Mandarin,3*8,200 ml
7 - Eleven,ศูนย์กระจายสินค้า RDC สุราษฏร์ธานี,3/1/23,2023-03-01T00:00:00.000Z,2023,3,1,,100%Mandarin Orange Malee 200ml 3x8 Leaf,,BRI,,252.0,Fruit Juice,Orange-Mandarin,3*8,200 ml
7 - Eleven,บริษัท ซีพี ออลล์ จำกัด (มหาชน),3/1/23,2023-03-01T00:00:00.000Z,2023,3,1,,100%Mandarin Orange Malee 200ml 3x8 Leaf,,BRI,,1296.0,Fruit Juice,Orange-Mandarin,3*8,200 ml
7 - Eleven,ศูนย์กระจายสินค้า RDCชลบุรีใหม่ W121,3/2/23,2023-03-02T00:00:00.000Z,2023,3,2,,100%Mandarin Orange Malee 200ml 3x8 Leaf,,BRI,,168.0,Fruit Juice,Orange-Mandarin,3*8,200 ml
7 - Eleven,ศูนย์กระจายสินค้า RDC WESTมหาชัย,3/2/23,2023-03-02T00:00:00.000Z,2023,3,2,,100%Mandarin Orange Malee 200ml 3x8 Leaf,,BRI,,168.0,Fruit Juice,Orange-Mandarin,3*8,200 ml
7 - Eleven,ศูนย์กระจายสินค้า DC5 สุวรรณภูมิ,3/2/23,2023-03-02T00:00:00.000Z,2023,3,2,,100%Mandarin Orange Malee 200ml 3x8 Leaf,,BRI,,168.0,Fruit Juice,Orange-Mandarin,3*8,200 ml
7 - Eleven,ศุนย์กระจายสินค้า นครสวรรค์(RDC นครสวรรค์),3/2/23,2023-03-02T00:00:00.000Z,2023,3,2,,100%Mandarin Orange Malee 200ml 3x8 Leaf,,BRI,,147.0,Fruit Juice,Orange-Mandarin,3*8,200 ml
7 - Eleven,บริษัท ซีพี ออลล์ จำกัด (มหาชน),3/2/23,2023-03-02T00:00:00.000Z,2023,3,2,,100%Mandarin Orange Malee 200ml 3x8 Leaf,,BRI,,1456.0,Fruit Juice,Orange-Mandarin,3*8,200 ml
7 - Eleven,บริษัท ซีพี ออลล์ จำกัด (มหาชน),3/3/23,2023-03-03T00:00:00.000Z,2023,3,3,,100%Mandarin Orange Malee 200ml 3x8 Leaf,,BRI,,288.0,Fruit Juice,Orange-Mandarin,3*8,200 ml
7 - Eleven,ศูนย์กระจายสินค้า RDC สุราษฏร์ธานี,3/4/23,2023-03-04T00:00:00.000Z,2023,3,4,,100%Mandarin Orange Malee 200ml 3x8 Leaf,,BRI,,63.0,Fruit Juice,Orange-Mandarin,3*8,200 ml
7 - Eleven,ศุนย์กระจายสินค้า หาดใหญ่(RDC หาดใหญ่),3/4/23,2023-03-04T00:00:00.000Z,2023,3,4,,100%Mandarin Orange Malee 200ml 3x8 Leaf,,BRI,,126.0,Fruit Juice,Orange-Mandarin,3*8,200 ml
7 - Eleven,ศุนย์กระจายสินค้า นครสวรรค์(RDC นครสวรรค์),3/4/23,2023-03-04T00:00:00.000Z,2023,3,4,,100%Mandarin Orange Malee 200ml 3x8 Leaf,,BRI,,147.0,Fruit Juice,Orange-Mandarin,3*8,200 ml
7 - Eleven,บริษัท ซีพี ออลล์ จำกัด (มหาชน),3/4/23,2023-03-04T00:00:00.000Z,2023,3,4,,100%Mandarin Orange Malee 200ml 3x8 Leaf,,BRI,,512.0,Fruit Juice,Orange-Mandarin,3*8,200 ml
7 - Eleven,ศูนย์กระจายสินค้า RDCชลบุรีใหม่ W121,3/7/23,2023-03-07T00:00:00.000Z,2023,3,7,,100%Mandarin Orange Malee 200ml 3x8 Leaf,,BRI,,168.0,Fruit Juice,Orange-Mandarin,3*8,200 ml
7 - Eleven,ศูนย์กระจายสินค้า RDC WESTมหาชัย,3/7/23,2023-03-07T00:00:00.000Z,2023,3,7,,100%Mandarin Orange Malee 200ml 3x8 Leaf,,BRI,,252.0,Fruit Juice,Orange-Mandarin,3*8,200 ml
7 - Eleven,ศูนย์กระจายสินค้า DC5 สุวรรณภูมิ,3/7/23,2023-03-07T00:00:00.000Z,2023,3,7,,100%Mandarin Orange Malee 200ml 3x8 Leaf,,BRI,,168.0,Fruit Juice,Orange-Mandarin,3*8,200 ml
7 - Eleven,ศูนย์กระจายสินค้า RDC WESTมหาชัย,3/8/23,2023-03-08T00:00:00.000Z,2023,3,8,,100%Mandarin Orange Malee 200ml 3x8 Leaf,,BRI,,84.0,Fruit Juice,Orange-Mandarin,3*8,200 ml
7 - Eleven,ศูนย์กระจายสินค้า RDC สุราษฏร์ธานี,3/15/23,2023-03-15T00:00:00.000Z,2023,3,15,,100%Mandarin Orange Malee 200ml 3x8 Leaf,,BRI,,63.0,Fruit Juice,Orange-Mandarin,3*8,200 ml
7 - Eleven,ศูนย์กระจายสินค้า RDC สุราษฏร์ธานี,3/18/23,2023-03-18T00:00:00.000Z,2023,3,18,,100%Mandarin Orange Malee 200ml 3x8 Leaf,,BRI,,63.0,Fruit Juice,Orange-Mandarin,3*8,200 ml
7 - Eleven,ศุนย์กระจายสินค้า หาดใหญ่(RDC หาดใหญ่),3/18/23,2023-03-18T00:00:00.000Z,2023,3,18,,100%Mandarin Orange Malee 200ml 3x8 Leaf,,BRI,,-1.0,Fruit Juice,Orange-Mandarin,3*8,200 ml
7 - Eleven,ศุนย์กระจายสินค้า หาดใหญ่(RDC หาดใหญ่),3/22/23,2023-03-22T00:00:00.000Z,2023,3,22,,100%Mandarin Orange Malee 200ml 3x8 Leaf,,BRI,,41.0,Fruit Juice,Orange-Mandarin,3*8,200 ml
7 - Eleven,ศูนย์กระจายสินค้า RDCชลบุรีใหม่ W121,3/27/23,2023-03-27T00:00:00.000Z,2023,3,27,,100%Mandarin Orange Malee 200ml 3x8 Leaf,,BRI,,210.0,Fruit Juice,Orange-Mandarin,3*8,200 ml
7 - Eleven,ศูนย์กระจายสินค้า RDC สุราษฏร์ธานี,3/27/23,2023-03-27T00:00:00.000Z,2023,3,27,,100%Mandarin Orange Malee 200ml 3x8 Leaf,,BRI,,126.0,Fruit Juice,Orange-Mandarin,3*8,200 ml
7 - Eleven,ศูนย์กระจายสินค้าขอนแก่น (W801),3/28/23,2023-03-28T00:00:00.000Z,2023,3,28,,100%Mandarin Orange Malee 200ml 3x8 Leaf,,BRI,,84.0,Fruit Juice,Orange-Mandarin,3*8,200 ml
7 - Eleven,ศูนย์กระจายสินค้า RDCชลบุรีใหม่ W121,3/28/23,2023-03-28T00:00:00.000Z,2023,3,28,,100%Mandarin Orange Malee 200ml 3x8 Leaf,,BRI,,42.0,Fruit Juice,Orange-Mandarin,3*8,200 ml
7 - Eleven,ศูนย์กระจายสินค้า DC5 สุวรรณภูมิ,3/28/23,2023-03-28T00:00:00.000Z,2023,3,28,,100%Mandarin Orange Malee 200ml 3x8 Leaf,,BRI,,168.0,Fruit Juice,Orange-Mandarin,3*8,200 ml
7 - Eleven,บริษัท ซีพี ออลล์ จำกัด (มหาชน),3/28/23,2023-03-28T00:00:00.000Z,2023,3,28,,100%Mandarin Orange Malee 200ml 3x8 Leaf,,BRI,,40.0,Fruit Juice,Orange-Mandarin,3*8,200 ml
7 - Eleven,ศูนย์กระจายสินค้า RDCชลบุรีใหม่ W121,3/29/23,2023-03-29T00:00:00.000Z,2023,3,29,,100%Mandarin Orange Malee 200ml 3x8 Leaf,,BRI,,168.0,Fruit Juice,Orange-Mandarin,3*8,200 ml
7 - Eleven,ศูนย์กระจายสินค้า RDC สุราษฏร์ธานี,3/29/23,2023-03-29T00:00:00.000Z,2023,3,29,,100%Mandarin Orange Malee 200ml 3x8 Leaf,,BRI,,189.0,Fruit Juice,Orange-Mandarin,3*8,200 ml
7 - Eleven,ศูนย์กระจายสินค้า DC5 สุวรรณภูมิ,3/29/23,2023-03-29T00:00:00.000Z,2023,3,29,,100%Mandarin Orange Malee 200ml 3x8 Leaf,,BRI,,168.0,Fruit Juice,Orange-Mandarin,3*8,200 ml
7 - Eleven,ศูนย์กระจายสินค้าขอนแก่น (W801),3/30/23,2023-03-30T00:00:00.000Z,2023,3,30,,100%Mandarin Orange Malee 200ml 3x8 Leaf,,BRI,,63.0,Fruit Juice,Orange-Mandarin,3*8,200 ml
7 - Eleven,บริษัท ซีพี ออลล์ จำกัด (มหาชน),3/30/23,2023-03-30T00:00:00.000Z,2023,3,30,,100%Mandarin Orange Malee 200ml 3x8 Leaf,,BRI,,227.0,Fruit Juice,Orange-Mandarin,3*8,200 ml
7 - Eleven,ศูนย์กระจายสินค้าขอนแก่น (W801),4/1/23,2023-04-01T00:00:00.000Z,2023,4,1,,100%Mandarin Orange Malee 200ml 3x8 Leaf,,BRI,,21.0,Fruit Juice,Orange-Mandarin,3*8,200 ml
7 - Eleven,ศูนย์กระจายสินค้า RDCชลบุรีใหม่ W121,4/1/23,2023-04-01T00:00:00.000Z,2023,4,1,,100%Mandarin Orange Malee 200ml 3x8 Leaf,,BRI,,168.0,Fruit Juice,Orange-Mandarin,3*8,200 ml
7 - Eleven,ศูนย์กระจายสินค้า RDC สุราษฏร์ธานี,4/1/23,2023-04-01T00:00:00.000Z,2023,4,1,,100%Mandarin Orange Malee 200ml 3x8 Leaf,,BRI,,126.0,Fruit Juice,Orange-Mandarin,3*8,200 ml
7 - Eleven,ศูนย์กระจายสินค้า RDC WESTมหาชัย,4/1/23,2023-04-01T00:00:00.000Z,2023,4,1,,100%Mandarin Orange Malee 200ml 3x8 Leaf,,BRI,,168.0,Fruit Juice,Orange-Mandarin,3*8,200 ml
7 - Eleven,ศูนย์กระจายสินค้า DC5 สุวรรณภูมิ,4/1/23,2023-04-01T00:00:00.000Z,2023,4,1,,100%Mandarin Orange Malee 200ml 3x8 Leaf,,BRI,,168.0,Fruit Juice,Orange-Mandarin,3*8,200 ml
7 - Eleven,บริษัท ซีพี ออลล์ จำกัด (มหาชน),4/1/23,2023-04-01T00:00:00.000Z,2023,4,1,,100%Mandarin Orange Malee 200ml 3x8 Leaf,,BRI,,184.0,Fruit Juice,Orange-Mandarin,3*8,200 ml
7 - Eleven,ศูนย์กระจายสินค้า RDC WESTมหาชัย,4/3/23,2023-04-03T00:00:00.000Z,2023,4,3,,100%Mandarin Orange Malee 200ml 3x8 Leaf,,BRI,,42.0,Fruit Juice,Orange-Mandarin,3*8,200 ml
7 - Eleven,ศูนย์กระจายสินค้า DC5 สุวรรณภูมิ,4/3/23,2023-04-03T00:00:00.000Z,2023,4,3,,100%Mandarin Orange Malee 200ml 3x8 Leaf,,BRI,,273.0,Fruit Juice,Orange-Mandarin,3*8,200 ml
7 - Eleven,บริษัท ซีพี ออลล์ จำกัด (มหาชน),4/3/23,2023-04-03T00:00:00.000Z,2023,4,3,,100%Mandarin Orange Malee 200ml 3x8 Leaf,,BRI,,291.0,Fruit Juice,Orange-Mandarin,3*8,200 ml
7 - Eleven,ศูนย์กระจายสินค้าขอนแก่น (W801),4/4/23,2023-04-04T00:00:00.000Z,2023,4,4,,100%Mandarin Orange Malee 200ml 3x8 Leaf,,BRI,,210.0,Fruit Juice,Orange-Mandarin,3*8,200 ml
7 - Eleven,ศูนย์กระจายสินค้า RDCชลบุรีใหม่ W121,4/4/23,2023-04-04T00:00:00.000Z,2023,4,4,,100%Mandarin Orange Malee 200ml 3x8 Leaf,,BRI,,147.0,Fruit Juice,Orange-Mandarin,3*8,200 ml
7 - Eleven,ศูนย์กระจายสินค้า RDC WESTมหาชัย,4/4/23,2023-04-04T00:00:00.000Z,2023,4,4,,100%Mandarin Orange Malee 200ml 3x8 Leaf,,BRI,,21.0,Fruit Juice,Orange-Mandarin,3*8,200 ml
7 - Eleven,ศุนย์กระจายสินค้า นครสวรรค์(RDC นครสวรรค์),4/4/23,2023-04-04T00:00:00.000Z,2023,4,4,,100%Mandarin Orange Malee 200ml 3x8 Leaf,,BRI,,147.0,Fruit Juice,Orange-Mandarin,3*8,200 ml
7 - Eleven,บริษัท ซีพี ออลล์ จำกัด (มหาชน),4/4/23,2023-04-04T00:00:00.000Z,2023,4,4,,100%Mandarin Orange Malee 200ml 3x8 Leaf,,BRI,,304.0,Fruit Juice,Orange-Mandarin,3*8,200 ml
7 - Eleven,ศูนย์กระจายสินค้า RDCชลบุรีใหม่ W121,4/5/23,2023-04-05T00:00:00.000Z,2023,4,5,,100%Mandarin Orange Malee 200ml 3x8 Leaf,,BRI,,84.0,Fruit Juice,Orange-Mandarin,3*8,200 ml
7 - Eleven,ศูนย์กระจายสินค้า RDC สุราษฏร์ธานี,4/5/23,2023-04-05T00:00:00.000Z,2023,4,5,,100%Mandarin Orange Malee 200ml 3x8 Leaf,,BRI,,210.0,Fruit Juice,Orange-Mandarin,3*8,200 ml
7 - Eleven,ศูนย์กระจายสินค้า RDC WESTมหาชัย,4/5/23,2023-04-05T00:00:00.000Z,2023,4,5,,100%Mandarin Orange Malee 200ml 3x8 Leaf,,BRI,,63.0,Fruit Juice,Orange-Mandarin,3*8,200 ml
7 - Eleven,ศูนย์กระจายสินค้า DC5 สุวรรณภูมิ,4/5/23,2023-04-05T00:00:00.000Z,2023,4,5,,100%Mandarin Orange Malee 200ml 3x8 Leaf,,BRI,,126.0,Fruit Juice,Orange-Mandarin,3*8,200 ml
7 - Eleven,ศุนย์กระจายสินค้า หาดใหญ่(RDC หาดใหญ่),4/5/23,2023-04-05T00:00:00.000Z,2023,4,5,,100%Mandarin Orange Malee 200ml 3x8 Leaf,,BRI,,42.0,Fruit Juice,Orange-Mandarin,3*8,200 ml
7 - Eleven,บริษัท ซีพี ออลล์ จำกัด (มหาชน),4/5/23,2023-04-05T00:00:00.000Z,2023,4,5,,100%Mandarin Orange Malee 200ml 3x8 Leaf,,BRI,,144.0,Fruit Juice,Orange-Mandarin,3*8,200 ml
7 - Eleven,ศูนย์กระจายสินค้าขอนแก่น (W801),4/6/23,2023-04-06T00:00:00.000Z,2023,4,6,,100%Mandarin Orange Malee 200ml 3x8 Leaf,,BRI,,63.0,Fruit Juice,Orange-Mandarin,3*8,200 ml
7 - Eleven,ศูนย์กระจายสินค้า RDCชลบุรีใหม่ W121,4/6/23,2023-04-06T00:00:00.000Z,2023,4,6,,100%Mandarin Orange Malee 200ml 3x8 Leaf,,BRI,,84.0,Fruit Juice,Orange-Mandarin,3*8,200 ml
7 - Eleven,ศูนย์กระจายสินค้า RDC WESTมหาชัย,4/6/23,2023-04-06T00:00:00.000Z,2023,4,6,,100%Mandarin Orange Malee 200ml 3x8 Leaf,,BRI,,42.0,Fruit Juice,Orange-Mandarin,3*8,200 ml
7 - Eleven,ศูนย์กระจายสินค้า DC5 สุวรรณภูมิ,4/6/23,2023-04-06T00:00:00.000Z,2023,4,6,,100%Mandarin Orange Malee 200ml 3x8 Leaf,,BRI,,168.0,Fruit Juice,Orange-Mandarin,3*8,200 ml
7 - Eleven,ศุนย์กระจายสินค้า นครสวรรค์(RDC นครสวรรค์),4/6/23,2023-04-06T00:00:00.000Z,2023,4,6,,100%Mandarin Orange Malee 200ml 3x8 Leaf,,BRI,,105.0,Fruit Juice,Orange-Mandarin,3*8,200 ml
7 - Eleven,บริษัท ซีพี ออลล์ จำกัด (มหาชน),4/6/23,2023-04-06T00:00:00.000Z,2023,4,6,,100%Mandarin Orange Malee 200ml 3x8 Leaf,,BRI,,187.0,Fruit Juice,Orange-Mandarin,3*8,200 ml
7 - Eleven,ศูนย์กระจายสินค้า RDCชลบุรีใหม่ W121,4/7/23,2023-04-07T00:00:00.000Z,2023,4,7,,100%Mandarin Orange Malee 200ml 3x8 Leaf,,BRI,,63.0,Fruit Juice,Orange-Mandarin,3*8,200 ml
7 - Eleven,ศูนย์กระจายสินค้า RDC WESTมหาชัย,4/7/23,2023-04-07T00:00:00.000Z,2023,4,7,,100%Mandarin Orange Malee 200ml 3x8 Leaf,,BRI,,168.0,Fruit Juice,Orange-Mandarin,3*8,200 ml
7 - Eleven,ศูนย์กระจายสินค้า DC5 สุวรรณภูมิ,4/7/23,2023-04-07T00:00:00.000Z,2023,4,7,,100%Mandarin Orange Malee 200ml 3x8 Leaf,,BRI,,105.0,Fruit Juice,Orange-Mandarin,3*8,200 ml
7 - Eleven,ศูนย์กระจายสินค้าขอนแก่น (W801),4/10/23,2023-04-10T00:00:00.000Z,2023,4,10,,100%Mandarin Orange Malee 200ml 3x8 Leaf,,BRI,,84.0,Fruit Juice,Orange-Mandarin,3*8,200 ml
7 - Eleven,ศูนย์กระจายสินค้า RDCชลบุรีใหม่ W121,4/10/23,2023-04-10T00:00:00.000Z,2023,4,10,,100%Mandarin Orange Malee 200ml 3x8 Leaf,,BRI,,294.0,Fruit Juice,Orange-Mandarin,3*8,200 ml
7 - Eleven,ศูนย์กระจายสินค้า RDC สุราษฏร์ธานี,4/10/23,2023-04-10T00:00:00.000Z,2023,4,10,,100%Mandarin Orange Malee 200ml 3x8 Leaf,,BRI,,126.0,Fruit Juice,Orange-Mandarin,3*8,200 ml
7 - Eleven,ศูนย์กระจายสินค้า RDC WESTมหาชัย,4/10/23,2023-04-10T00:00:00.000Z,2023,4,10,,100%Mandarin Orange Malee 200ml 3x8 Leaf,,BRI,,84.0,Fruit Juice,Orange-Mandarin,3*8,200 ml
7 - Eleven,ศูนย์กระจายสินค้า DC5 สุวรรณภูมิ,4/10/23,2023-04-10T00:00:00.000Z,2023,4,10,,100%Mandarin Orange Malee 200ml 3x8 Leaf,,BRI,,168.0,Fruit Juice,Orange-Mandarin,3*8,200 ml
7 - Eleven,ศุนย์กระจายสินค้า หาดใหญ่(RDC หาดใหญ่),4/10/23,2023-04-10T00:00:00.000Z,2023,4,10,,100%Mandarin Orange Malee 200ml 3x8 Leaf,,BRI,,63.0,Fruit Juice,Orange-Mandarin,3*8,200 ml
7 - Eleven,ศุนย์กระจายสินค้า นครสวรรค์(RDC นครสวรรค์),4/10/23,2023-04-10T00:00:00.000Z,2023,4,10,,100%Mandarin Orange Malee 200ml 3x8 Leaf,,BRI,,42.0,Fruit Juice,Orange-Mandarin,3*8,200 ml
7 - Eleven,บริษัท ซีพี ออลล์ จำกัด (มหาชน),4/10/23,2023-04-10T00:00:00.000Z,2023,4,10,,100%Mandarin Orange Malee 200ml 3x8 Leaf,,BRI,,435.0,Fruit Juice,Orange-Mandarin,3*8,200 ml
7 - Eleven,ศูนย์กระจายสินค้าขอนแก่น (W801),4/11/23,2023-04-11T00:00:00.000Z,2023,4,11,,100%Mandarin Orange Malee 200ml 3x8 Leaf,,BRI,,168.0,Fruit Juice,Orange-Mandarin,3*8,200 ml
7 - Eleven,ศูนย์กระจายสินค้า RDC WESTมหาชัย,4/11/23,2023-04-11T00:00:00.000Z,2023,4,11,,100%Mandarin Orange Malee 200ml 3x8 Leaf,,BRI,,63.0,Fruit Juice,Orange-Mandarin,3*8,200 ml
7 - Eleven,ศูนย์กระจายสินค้า DC5 สุวรรณภูมิ,4/11/23,2023-04-11T00:00:00.000Z,2023,4,11,,100%Mandarin Orange Malee 200ml 3x8 Leaf,,BRI,,105.0,Fruit Juice,Orange-Mandarin,3*8,200 ml
7 - Eleven,ศุนย์กระจายสินค้า นครสวรรค์(RDC นครสวรรค์),4/11/23,2023-04-11T00:00:00.000Z,2023,4,11,,100%Mandarin Orange Malee 200ml 3x8 Leaf,,BRI,,147.0,Fruit Juice,Orange-Mandarin,3*8,200 ml
7 - Eleven,บริษัท ซีพี ออลล์ จำกัด (มหาชน),4/11/23,2023-04-11T00:00:00.000Z,2023,4,11,,100%Mandarin Orange Malee 200ml 3x8 Leaf,,BRI,,344.0,Fruit Juice,Orange-Mandarin,3*8,200 ml
7 - Eleven,ศูนย์กระจายสินค้า RDCชลบุรีใหม่ W121,4/12/23,2023-04-12T00:00:00.000Z,2023,4,12,,100%Mandarin Orange Malee 200ml 3x8 Leaf,,BRI,,84.0,Fruit Juice,Orange-Mandarin,3*8,200 ml
7 - Eleven,ศูนย์กระจายสินค้า RDC สุราษฏร์ธานี,4/12/23,2023-04-12T00:00:00.000Z,2023,4,12,,100%Mandarin Orange Malee 200ml 3x8 Leaf,,BRI,,315.0,Fruit Juice,Orange-Mandarin,3*8,200 ml
7 - Eleven,ศูนย์กระจายสินค้า RDC WESTมหาชัย,4/12/23,2023-04-12T00:00:00.000Z,2023,4,12,,100%Mandarin Orange Malee 200ml 3x8 Leaf,,BRI,,42.0,Fruit Juice,Orange-Mandarin,3*8,200 ml
7 - Eleven,ศูนย์กระจายสินค้า DC5 สุวรรณภูมิ,4/12/23,2023-04-12T00:00:00.000Z,2023,4,12,,100%Mandarin Orange Malee 200ml 3x8 Leaf,,BRI,,84.0,Fruit Juice,Orange-Mandarin,3*8,200 ml
7 - Eleven,ศุนย์กระจายสินค้า หาดใหญ่(RDC หาดใหญ่),4/12/23,2023-04-12T00:00:00.000Z,2023,4,12,,100%Mandarin Orange Malee 200ml 3x8 Leaf,,BRI,,84.0,Fruit Juice,Orange-Mandarin,3*8,200 ml
7 - Eleven,ศูนย์กระจายสินค้าขอนแก่น (W801),4/13/23,2023-04-13T00:00:00.000Z,2023,4,13,,100%Mandarin Orange Malee 200ml 3x8 Leaf,,BRI,,84.0,Fruit Juice,Orange-Mandarin,3*8,200 ml
7 - Eleven,ศูนย์กระจายสินค้า RDC WESTมหาชัย,4/13/23,2023-04-13T00:00:00.000Z,2023,4,13,,100%Mandarin Orange Malee 200ml 3x8 Leaf,,BRI,,84.0,Fruit Juice,Orange-Mandarin,3*8,200 ml
7 - Eleven,ศุนย์กระจายสินค้า นครสวรรค์(RDC นครสวรรค์),4/13/23,2023-04-13T00:00:00.000Z,2023,4,13,,100%Mandarin Orange Malee 200ml 3x8 Leaf,,BRI,,105.0,Fruit Juice,Orange-Mandarin,3*8,200 ml
7 - Eleven,บริษัท ซีพี ออลล์ จำกัด (มหาชน),4/13/23,2023-04-13T00:00:00.000Z,2023,4,13,,100%Mandarin Orange Malee 200ml 3x8 Leaf,,BRI,,411.0,Fruit Juice,Orange-Mandarin,3*8,200 ml
7 - Eleven,ศูนย์กระจายสินค้า RDCชลบุรีใหม่ W121,4/14/23,2023-04-14T00:00:00.000Z,2023,4,14,,100%Mandarin Orange Malee 200ml 3x8 Leaf,,BRI,,168.0,Fruit Juice,Orange-Mandarin,3*8,200 ml
7 - Eleven,ศูนย์กระจายสินค้า RDC WESTมหาชัย,4/14/23,2023-04-14T00:00:00.000Z,2023,4,14,,100%Mandarin Orange Malee 200ml 3x8 Leaf,,BRI,,84.0,Fruit Juice,Orange-Mandarin,3*8,200 ml
7 - Eleven,ศูนย์กระจายสินค้า DC5 สุวรรณภูมิ,4/14/23,2023-04-14T00:00:00.000Z,2023,4,14,,100%Mandarin Orange Malee 200ml 3x8 Leaf,,BRI,,105.0,Fruit Juice,Orange-Mandarin,3*8,200 ml
7 - Eleven,บริษัท ซีพี ออลล์ จำกัด (มหาชน),4/14/23,2023-04-14T00:00:00.000Z,2023,4,14,,100%Mandarin Orange Malee 200ml 3x8 Leaf,,BRI,,144.0,Fruit Juice,Orange-Mandarin,3*8,200 ml
7 - Eleven,ศูนย์กระจายสินค้า RDCชลบุรีใหม่ W121,4/15/23,2023-04-15T00:00:00.000Z,2023,4,15,,100%Mandarin Orange Malee 200ml 3x8 Leaf,,BRI,,168.0,Fruit Juice,Orange-Mandarin,3*8,200 ml
7 - Eleven,ศูนย์กระจายสินค้า RDC สุราษฏร์ธานี,4/15/23,2023-04-15T00:00:00.000Z,2023,4,15,,100%Mandarin Orange Malee 200ml 3x8 Leaf,,BRI,,42.0,Fruit Juice,Orange-Mandarin,3*8,200 ml
7 - Eleven,ศูนย์กระจายสินค้า RDC WESTมหาชัย,4/15/23,2023-04-15T00:00:00.000Z,2023,4,15,,100%Mandarin Orange Malee 200ml 3x8 Leaf,,BRI,,168.0,Fruit Juice,Orange-Mandarin,3*8,200 ml
7 - Eleven,ศูนย์กระจายสินค้า DC5 สุวรรณภูมิ,4/15/23,2023-04-15T00:00:00.000Z,2023,4,15,,100%Mandarin Orange Malee 200ml 3x8 Leaf,,BRI,,168.0,Fruit Juice,Orange-Mandarin,3*8,200 ml
7 - Eleven,ศุนย์กระจายสินค้า หาดใหญ่(RDC หาดใหญ่),4/15/23,2023-04-15T00:00:00.000Z,2023,4,15,,100%Mandarin Orange Malee 200ml 3x8 Leaf,,BRI,,63.0,Fruit Juice,Orange-Mandarin,3*8,200 ml
7 - Eleven,ศุนย์กระจายสินค้า นครสวรรค์(RDC นครสวรรค์),4/15/23,2023-04-15T00:00:00.000Z,2023,4,15,,100%Mandarin Orange Malee 200ml 3x8 Leaf,,BRI,,42.0,Fruit Juice,Orange-Mandarin,3*8,200 ml
7 - Eleven,ศูนย์กระจายสินค้าขอนแก่น (W801),4/18/23,2023-04-18T00:00:00.000Z,2023,4,18,,100%Mandarin Orange Malee 200ml 3x8 Leaf,,BRI,,84.0,Fruit Juice,Orange-Mandarin,3*8,200 ml
7 - Eleven,ศูนย์กระจายสินค้า DC5 สุวรรณภูมิ,4/18/23,2023-04-18T00:00:00.000Z,2023,4,18,,100%Mandarin Orange Malee 200ml 3x8 Leaf,,BRI,,189.0,Fruit Juice,Orange-Mandarin,3*8,200 ml
7 - Eleven,บริษัท ซีพี ออลล์ จำกัด (มหาชน),4/18/23,2023-04-18T00:00:00.000Z,2023,4,18,,100%Mandarin Orange Malee 200ml 3x8 Leaf,,BRI,,781.0,Fruit Juice,Orange-Mandarin,3*8,200 ml
7 - Eleven,ศูนย์กระจายสินค้าขอนแก่น (W801),4/20/23,2023-04-20T00:00:00.000Z,2023,4,20,,100%Mandarin Orange Malee 200ml 3x8 Leaf,,BRI,,42.0,Fruit Juice,Orange-Mandarin,3*8,200 ml
7 - Eleven,ศูนย์กระจายสินค้า RDCชลบุรีใหม่ W121,4/20/23,2023-04-20T00:00:00.000Z,2023,4,20,,100%Mandarin Orange Malee 200ml 3x8 Leaf,,BRI,,84.0,Fruit Juice,Orange-Mandarin,3*8,200 ml
7 - Eleven,ศูนย์กระจายสินค้า RDC สุราษฏร์ธานี,4/20/23,2023-04-20T00:00:00.000Z,2023,4,20,,100%Mandarin Orange Malee 200ml 3x8 Leaf,,BRI,,189.0,Fruit Juice,Orange-Mandarin,3*8,200 ml
7 - Eleven,ศูนย์กระจายสินค้า RDC WESTมหาชัย,4/20/23,2023-04-20T00:00:00.000Z,2023,4,20,,100%Mandarin Orange Malee 200ml 3x8 Leaf,,BRI,,84.0,Fruit Juice,Orange-Mandarin,3*8,200 ml
7 - Eleven,ศูนย์กระจายสินค้า DC5 สุวรรณภูมิ,4/20/23,2023-04-20T00:00:00.000Z,2023,4,20,,100%Mandarin Orange Malee 200ml 3x8 Leaf,,BRI,,252.0,Fruit Juice,Orange-Mandarin,3*8,200 ml
7 - Eleven,ศุนย์กระจายสินค้า หาดใหญ่(RDC หาดใหญ่),4/20/23,2023-04-20T00:00:00.000Z,2023,4,20,,100%Mandarin Orange Malee 200ml 3x8 Leaf,,BRI,,84.0,Fruit Juice,Orange-Mandarin,3*8,200 ml
7 - Eleven,ศุนย์กระจายสินค้า นครสวรรค์(RDC นครสวรรค์),4/20/23,2023-04-20T00:00:00.000Z,2023,4,20,,100%Mandarin Orange Malee 200ml 3x8 Leaf,,BRI,,147.0,Fruit Juice,Orange-Mandarin,3*8,200 ml
7 - Eleven,บริษัท ซีพี ออลล์ จำกัด (มหาชน),4/20/23,2023-04-20T00:00:00.000Z,2023,4,20,,100%Mandarin Orange Malee 200ml 3x8 Leaf,,BRI,,145.0,Fruit Juice,Orange-Mandarin,3*8,200 ml
7 - Eleven,ศูนย์กระจายสินค้า RDCชลบุรีใหม่ W121,4/21/23,2023-04-21T00:00:00.000Z,2023,4,21,,100%Mandarin Orange Malee 200ml 3x8 Leaf,,BRI,,168.0,Fruit Juice,Orange-Mandarin,3*8,200 ml
7 - Eleven,ศูนย์กระจายสินค้า RDC WESTมหาชัย,4/21/23,2023-04-21T00:00:00.000Z,2023,4,21,,100%Mandarin Orange Malee 200ml 3x8 Leaf,,BRI,,105.0,Fruit Juice,Orange-Mandarin,3*8,200 ml
7 - Eleven,บริษัท ซีพี ออลล์ จำกัด (มหาชน),4/21/23,2023-04-21T00:00:00.000Z,2023,4,21,,100%Mandarin Orange Malee 200ml 3x8 Leaf,,BRI,,144.0,Fruit Juice,Orange-Mandarin,3*8,200 ml
7 - Eleven,ศูนย์กระจายสินค้าขอนแก่น (W801),4/24/23,2023-04-24T00:00:00.000Z,2023,4,24,,100%Mandarin Orange Malee 200ml 3x8 Leaf,,BRI,,252.0,Fruit Juice,Orange-Mandarin,3*8,200 ml
7 - Eleven,ศูนย์กระจายสินค้า RDCชลบุรีใหม่ W121,4/24/23,2023-04-24T00:00:00.000Z,2023,4,24,,100%Mandarin Orange Malee 200ml 3x8 Leaf,,BRI,,84.0,Fruit Juice,Orange-Mandarin,3*8,200 ml
7 - Eleven,ศูนย์กระจายสินค้า RDC สุราษฏร์ธานี,4/24/23,2023-04-24T00:00:00.000Z,2023,4,24,,100%Mandarin Orange Malee 200ml 3x8 Leaf,,BRI,,63.0,Fruit Juice,Orange-Mandarin,3*8,200 ml
7 - Eleven,ศูนย์กระจายสินค้า RDC WESTมหาชัย,4/24/23,2023-04-24T00:00:00.000Z,2023,4,24,,100%Mandarin Orange Malee 200ml 3x8 Leaf,,BRI,,210.0,Fruit Juice,Orange-Mandarin,3*8,200 ml
7 - Eleven,ศูนย์กระจายสินค้า DC5 สุวรรณภูมิ,4/24/23,2023-04-24T00:00:00.000Z,2023,4,24,,100%Mandarin Orange Malee 200ml 3x8 Leaf,,BRI,,336.0,Fruit Juice,Orange-Mandarin,3*8,200 ml
7 - Eleven,ศุนย์กระจายสินค้า หาดใหญ่(RDC หาดใหญ่),4/24/23,2023-04-24T00:00:00.000Z,2023,4,24,,100%Mandarin Orange Malee 200ml 3x8 Leaf,,BRI,,42.0,Fruit Juice,Orange-Mandarin,3*8,200 ml
7 - Eleven,ศุนย์กระจายสินค้า นครสวรรค์(RDC นครสวรรค์),4/24/23,2023-04-24T00:00:00.000Z,2023,4,24,,100%Mandarin Orange Malee 200ml 3x8 Leaf,,BRI,,84.0,Fruit Juice,Orange-Mandarin,3*8,200 ml
7 - Eleven,บริษัท ซีพี ออลล์ จำกัด (มหาชน),4/24/23,2023-04-24T00:00:00.000Z,2023,4,24,,100%Mandarin Orange Malee 200ml 3x8 Leaf,,BRI,,557.0,Fruit Juice,Orange-Mandarin,3*8,200 ml
7 - Eleven,ศูนย์กระจายสินค้า RDCชลบุรีใหม่ W121,4/25/23,2023-04-25T00:00:00.000Z,2023,4,25,,100%Mandarin Orange Malee 200ml 3x8 Leaf,,BRI,,168.0,Fruit Juice,Orange-Mandarin,3*8,200 ml
7 - Eleven,บริษัท ซีพี ออลล์ จำกัด (มหาชน),4/25/23,2023-04-25T00:00:00.000Z,2023,4,25,,100%Mandarin Orange Malee 200ml 3x8 Leaf,,BRI,,144.0,Fruit Juice,Orange-Mandarin,3*8,200 ml
7 - Eleven,ศูนย์กระจายสินค้า RDC สุราษฏร์ธานี,4/26/23,2023-04-26T00:00:00.000Z,2023,4,26,,100%Mandarin Orange Malee 200ml 3x8 Leaf,,BRI,,189.0,Fruit Juice,Orange-Mandarin,3*8,200 ml
7 - Eleven,ศูนย์กระจายสินค้า RDC WESTมหาชัย,4/26/23,2023-04-26T00:00:00.000Z,2023,4,26,,100%Mandarin Orange Malee 200ml 3x8 Leaf,,BRI,,63.0,Fruit Juice,Orange-Mandarin,3*8,200 ml
7 - Eleven,ศูนย์กระจายสินค้า DC5 สุวรรณภูมิ,4/26/23,2023-04-26T00:00:00.000Z,2023,4,26,,100%Mandarin Orange Malee 200ml 3x8 Leaf,,BRI,,168.0,Fruit Juice,Orange-Mandarin,3*8,200 ml
7 - Eleven,ศุนย์กระจายสินค้า หาดใหญ่(RDC หาดใหญ่),4/26/23,2023-04-26T00:00:00.000Z,2023,4,26,,100%Mandarin Orange Malee 200ml 3x8 Leaf,,BRI,,126.0,Fruit Juice,Orange-Mandarin,3*8,200 ml
7 - Eleven,ศุนย์กระจายสินค้า นครสวรรค์(RDC นครสวรรค์),4/26/23,2023-04-26T00:00:00.000Z,2023,4,26,,100%Mandarin Orange Malee 200ml 3x8 Leaf,,BRI,,147.0,Fruit Juice,Orange-Mandarin,3*8,200 ml
7 - Eleven,บริษัท ซีพี ออลล์ จำกัด (มหาชน),4/26/23,2023-04-26T00:00:00.000Z,2023,4,26,,100%Mandarin Orange Malee 200ml 3x8 Leaf,,BRI,,304.0,Fruit Juice,Orange-Mandarin,3*8,200 ml
7 - Eleven,ศูนย์กระจายสินค้า DC5 สุวรรณภูมิ,4/27/23,2023-04-27T00:00:00.000Z,2023,4,27,,100%Mandarin Orange Malee 200ml 3x8 Leaf,,BRI,,42.0,Fruit Juice,Orange-Mandarin,3*8,200 ml
7 - Eleven,ศูนย์กระจายสินค้า RDC WESTมหาชัย,4/28/23,2023-04-28T00:00:00.000Z,2023,4,28,,100%Mandarin Orange Malee 200ml 3x8 Leaf,,BRI,,21.0,Fruit Juice,Orange-Mandarin,3*8,200 ml
7 - Eleven,บริษัท ซีพี ออลล์ จำกัด (มหาชน),4/28/23,2023-04-28T00:00:00.000Z,2023,4,28,,100%Mandarin Orange Malee 200ml 3x8 Leaf,,BRI,,288.0,Fruit Juice,Orange-Mandarin,3*8,200 ml
7 - Eleven,ศูนย์กระจายสินค้า RDCชลบุรีใหม่ W121,4/29/23,2023-04-29T00:00:00.000Z,2023,4,29,,100%Mandarin Orange Malee 200ml 3x8 Leaf,,BRI,,168.0,Fruit Juice,Orange-Mandarin,3*8,200 ml
7 - Eleven,ศูนย์กระจายสินค้า RDC สุราษฏร์ธานี,4/29/23,2023-04-29T00:00:00.000Z,2023,4,29,,100%Mandarin Orange Malee 200ml 3x8 Leaf,,BRI,,63.0,Fruit Juice,Orange-Mandarin,3*8,200 ml
7 - Eleven,ศูนย์กระจายสินค้า RDC WESTมหาชัย,4/29/23,2023-04-29T00:00:00.000Z,2023,4,29,,100%Mandarin Orange Malee 200ml 3x8 Leaf,,BRI,,168.0,Fruit Juice,Orange-Mandarin,3*8,200 ml
7 - Eleven,ศูนย์กระจายสินค้า DC5 สุวรรณภูมิ,4/29/23,2023-04-29T00:00:00.000Z,2023,4,29,,100%Mandarin Orange Malee 200ml 3x8 Leaf,,BRI,,168.0,Fruit Juice,Orange-Mandarin,3*8,200 ml
7 - Eleven,ศุนย์กระจายสินค้า หาดใหญ่(RDC หาดใหญ่),4/29/23,2023-04-29T00:00:00.000Z,2023,4,29,,100%Mandarin Orange Malee 200ml 3x8 Leaf,,BRI,,126.0,Fruit Juice,Orange-Mandarin,3*8,200 ml
7 - Eleven,ศุนย์กระจายสินค้า นครสวรรค์(RDC นครสวรรค์),4/29/23,2023-04-29T00:00:00.000Z,2023,4,29,,100%Mandarin Orange Malee 200ml 3x8 Leaf,,BRI,,147.0,Fruit Juice,Orange-Mandarin,3*8,200 ml
7 - Eleven,ศูนย์กระจายสินค้าขอนแก่น (W801),5/2/23,2023-05-02T00:00:00.000Z,2023,5,2,,100%Mandarin Orange Malee 200ml 3x8 Leaf,,BRI,,21.0,Fruit Juice,Orange-Mandarin,3*8,200 ml
7 - Eleven,ศูนย์กระจายสินค้า RDC WESTมหาชัย,5/2/23,2023-05-02T00:00:00.000Z,2023,5,2,,100%Mandarin Orange Malee 200ml 3x8 Leaf,,BRI,,63.0,Fruit Juice,Orange-Mandarin,3*8,200 ml
7 - Eleven,บริษัท ซีพี ออลล์ จำกัด (มหาชน),5/2/23,2023-05-02T00:00:00.000Z,2023,5,2,,100%Mandarin Orange Malee 200ml 3x8 Leaf,,BRI,,63.0,Fruit Juice,Orange-Mandarin,3*8,200 ml
7 - Eleven,ศูนย์กระจายสินค้า RDCชลบุรีใหม่ W121,5/3/23,2023-05-03T00:00:00.000Z,2023,5,3,,100%Mandarin Orange Malee 200ml 3x8 Leaf,,BRI,,168.0,Fruit Juice,Orange-Mandarin,3*8,200 ml
7 - Eleven,ศูนย์กระจายสินค้า RDC สุราษฏร์ธานี,5/3/23,2023-05-03T00:00:00.000Z,2023,5,3,,100%Mandarin Orange Malee 200ml 3x8 Leaf,,BRI,,168.0,Fruit Juice,Orange-Mandarin,3*8,200 ml
7 - Eleven,ศูนย์กระจายสินค้า RDC WESTมหาชัย,5/3/23,2023-05-03T00:00:00.000Z,2023,5,3,,100%Mandarin Orange Malee 200ml 3x8 Leaf,,BRI,,84.0,Fruit Juice,Orange-Mandarin,3*8,200 ml
7 - Eleven,ศูนย์กระจายสินค้า DC5 สุวรรณภูมิ,5/3/23,2023-05-03T00:00:00.000Z,2023,5,3,,100%Mandarin Orange Malee 200ml 3x8 Leaf,,BRI,,252.0,Fruit Juice,Orange-Mandarin,3*8,200 ml
7 - Eleven,บริษัท ซีพี ออลล์ จำกัด (มหาชน),5/3/23,2023-05-03T00:00:00.000Z,2023,5,3,,100%Mandarin Orange Malee 200ml 3x8 Leaf,,BRI,,144.0,Fruit Juice,Orange-Mandarin,3*8,200 ml
7 - Eleven,ศูนย์กระจายสินค้าขอนแก่น (W801),5/4/23,2023-05-04T00:00:00.000Z,2023,5,4,,100%Mandarin Orange Malee 200ml 3x8 Leaf,,BRI,,168.0,Fruit Juice,Orange-Mandarin,3*8,200 ml
7 - Eleven,ศูนย์กระจายสินค้า RDC WESTมหาชัย,5/4/23,2023-05-04T00:00:00.000Z,2023,5,4,,100%Mandarin Orange Malee 200ml 3x8 Leaf,,BRI,,63.0,Fruit Juice,Orange-Mandarin,3*8,200 ml
7 - Eleven,ศูนย์กระจายสินค้า DC5 สุวรรณภูมิ,5/4/23,2023-05-04T00:00:00.000Z,2023,5,4,,100%Mandarin Orange Malee 200ml 3x8 Leaf,,BRI,,84.0,Fruit Juice,Orange-Mandarin,3*8,200 ml
7 - Eleven,ศุนย์กระจายสินค้า นครสวรรค์(RDC นครสวรรค์),5/4/23,2023-05-04T00:00:00.000Z,2023,5,4,,100%Mandarin Orange Malee 200ml 3x8 Leaf,,BRI,,21.0,Fruit Juice,Orange-Mandarin,3*8,200 ml
7 - Eleven,บริษัท ซีพี ออลล์ จำกัด (มหาชน),5/4/23,2023-05-04T00:00:00.000Z,2023,5,4,,100%Mandarin Orange Malee 200ml 3x8 Leaf,,BRI,,244.0,Fruit Juice,Orange-Mandarin,3*8,200 ml
7 - Eleven,ศูนย์กระจายสินค้า RDCชลบุรีใหม่ W121,5/5/23,2023-05-05T00:00:00.000Z,2023,5,5,,100%Mandarin Orange Malee 200ml 3x8 Leaf,,BRI,,105.0,Fruit Juice,Orange-Mandarin,3*8,200 ml
7 - Eleven,ศูนย์กระจายสินค้าขอนแก่น (W801),5/6/23,2023-05-06T00:00:00.000Z,2023,5,6,,100%Mandarin Orange Malee 200ml 3x8 Leaf,,BRI,,42.0,Fruit Juice,Orange-Mandarin,3*8,200 ml
7 - Eleven,ศูนย์กระจายสินค้า RDCชลบุรีใหม่ W121,5/6/23,2023-05-06T00:00:00.000Z,2023,5,6,,100%Mandarin Orange Malee 200ml 3x8 Leaf,,BRI,,168.0,Fruit Juice,Orange-Mandarin,3*8,200 ml
7 - Eleven,ศูนย์กระจายสินค้า RDC สุราษฏร์ธานี,5/6/23,2023-05-06T00:00:00.000Z,2023,5,6,,100%Mandarin Orange Malee 200ml 3x8 Leaf,,BRI,,63.0,Fruit Juice,Orange-Mandarin,3*8,200 ml
7 - Eleven,ศูนย์กระจายสินค้า RDC WESTมหาชัย,5/6/23,2023-05-06T00:00:00.000Z,2023,5,6,,100%Mandarin Orange Malee 200ml 3x8 Leaf,,BRI,,84.0,Fruit Juice,Orange-Mandarin,3*8,200 ml
7 - Eleven,ศูนย์กระจายสินค้า DC5 สุวรรณภูมิ,5/6/23,2023-05-06T00:00:00.000Z,2023,5,6,,100%Mandarin Orange Malee 200ml 3x8 Leaf,,BRI,,84.0,Fruit Juice,Orange-Mandarin,3*8,200 ml
7 - Eleven,ศุนย์กระจายสินค้า หาดใหญ่(RDC หาดใหญ่),5/6/23,2023-05-06T00:00:00.000Z,2023,5,6,,100%Mandarin Orange Malee 200ml 3x8 Leaf,,BRI,,126.0,Fruit Juice,Orange-Mandarin,3*8,200 ml
7 - Eleven,ศุนย์กระจายสินค้า นครสวรรค์(RDC นครสวรรค์),5/6/23,2023-05-06T00:00:00.000Z,2023,5,6,,100%Mandarin Orange Malee 200ml 3x8 Leaf,,BRI,,147.0,Fruit Juice,Orange-Mandarin,3*8,200 ml
7 - Eleven,บริษัท ซีพี ออลล์ จำกัด (มหาชน),5/6/23,2023-05-06T00:00:00.000Z,2023,5,6,,100%Mandarin Orange Malee 200ml 3x8 Leaf,,BRI,,304.0,Fruit Juice,Orange-Mandarin,3*8,200 ml
7 - Eleven,ศูนย์กระจายสินค้า DC5 สุวรรณภูมิ,5/8/23,2023-05-08T00:00:00.000Z,2023,5,8,,100%Mandarin Orange Malee 200ml 3x8 Leaf,,BRI,,84.0,Fruit Juice,Orange-Mandarin,3*8,200 ml
7 - Eleven,บริษัท ซีพี ออลล์ จำกัด (มหาชน),5/8/23,2023-05-08T00:00:00.000Z,2023,5,8,,100%Mandarin Orange Malee 200ml 3x8 Leaf,,BRI,,189.0,Fruit Juice,Orange-Mandarin,3*8,200 ml
7 - Eleven,ศูนย์กระจายสินค้าขอนแก่น (W801),5/9/23,2023-05-09T00:00:00.000Z,2023,5,9,,100%Mandarin Orange Malee 200ml 3x8 Leaf,,BRI,,63.0,Fruit Juice,Orange-Mandarin,3*8,200 ml
7 - Eleven,ศูนย์กระจายสินค้า RDCชลบุรีใหม่ W121,5/9/23,2023-05-09T00:00:00.000Z,2023,5,9,,100%Mandarin Orange Malee 200ml 3x8 Leaf,,BRI,,63.0,Fruit Juice,Orange-Mandarin,3*8,200 ml
7 - Eleven,บริษัท ซีพี ออลล์ จำกัด (มหาชน),5/9/23,2023-05-09T00:00:00.000Z,2023,5,9,,100%Mandarin Orange Malee 200ml 3x8 Leaf,,BRI,,60.0,Fruit Juice,Orange-Mandarin,3*8,200 ml
7 - Eleven,ศูนย์กระจายสินค้า RDC สุราษฏร์ธานี,5/10/23,2023-05-10T00:00:00.000Z,2023,5,10,,100%Mandarin Orange Malee 200ml 3x8 Leaf,,BRI,,168.0,Fruit Juice,Orange-Mandarin,3*8,200 ml
7 - Eleven,ศูนย์กระจายสินค้า RDC WESTมหาชัย,5/10/23,2023-05-10T00:00:00.000Z,2023,5,10,,100%Mandarin Orange Malee 200ml 3x8 Leaf,,BRI,,189.0,Fruit Juice,Orange-Mandarin,3*8,200 ml
7 - Eleven,ศูนย์กระจายสินค้า DC5 สุวรรณภูมิ,5/10/23,2023-05-10T00:00:00.000Z,2023,5,10,,100%Mandarin Orange Malee 200ml 3x8 Leaf,,BRI,,168.0,Fruit Juice,Orange-Mandarin,3*8,200 ml
7 - Eleven,ศุนย์กระจายสินค้า นครสวรรค์(RDC นครสวรรค์),5/10/23,2023-05-10T00:00:00.000Z,2023,5,10,,100%Mandarin Orange Malee 200ml 3x8 Leaf,,BRI,,42.0,Fruit Juice,Orange-Mandarin,3*8,200 ml
7 - Eleven,ศูนย์กระจายสินค้าขอนแก่น (W801),5/11/23,2023-05-11T00:00:00.000Z,2023,5,11,,100%Mandarin Orange Malee 200ml 3x8 Leaf,,BRI,,42.0,Fruit Juice,Orange-Mandarin,3*8,200 ml
7 - Eleven,ศูนย์กระจายสินค้า RDCชลบุรีใหม่ W121,5/11/23,2023-05-11T00:00:00.000Z,2023,5,11,,100%Mandarin Orange Malee 200ml 3x8 Leaf,,BRI,,42.0,Fruit Juice,Orange-Mandarin,3*8,200 ml
7 - Eleven,ศูนย์กระจายสินค้า DC5 สุวรรณภูมิ,5/11/23,2023-05-11T00:00:00.000Z,2023,5,11,,100%Mandarin Orange Malee 200ml 3x8 Leaf,,BRI,,168.0,Fruit Juice,Orange-Mandarin,3*8,200 ml
7 - Eleven,ศุนย์กระจายสินค้า นครสวรรค์(RDC นครสวรรค์),5/11/23,2023-05-11T00:00:00.000Z,2023,5,11,,100%Mandarin Orange Malee 200ml 3x8 Leaf,,BRI,,42.0,Fruit Juice,Orange-Mandarin,3*8,200 ml
7 - Eleven,บริษัท ซีพี ออลล์ จำกัด (มหาชน),5/11/23,2023-05-11T00:00:00.000Z,2023,5,11,,100%Mandarin Orange Malee 200ml 3x8 Leaf,,BRI,,207.0,Fruit Juice,Orange-Mandarin,3*8,200 ml
7 - Eleven,ศูนย์กระจายสินค้า RDCชลบุรีใหม่ W121,5/12/23,2023-05-12T00:00:00.000Z,2023,5,12,,100%Mandarin Orange Malee 200ml 3x8 Leaf,,BRI,,42.0,Fruit Juice,Orange-Mandarin,3*8,200 ml
7 - Eleven,บริษัท ซีพี ออลล์ จำกัด (มหาชน),5/12/23,2023-05-12T00:00:00.000Z,2023,5,12,,100%Mandarin Orange Malee 200ml 3x8 Leaf,,BRI,,144.0,Fruit Juice,Orange-Mandarin,3*8,200 ml
7 - Eleven,ศูนย์กระจายสินค้าขอนแก่น (W801),5/13/23,2023-05-13T00:00:00.000Z,2023,5,13,,100%Mandarin Orange Malee 200ml 3x8 Leaf,,BRI,,84.0,Fruit Juice,Orange-Mandarin,3*8,200 ml
7 - Eleven,ศูนย์กระจายสินค้า RDCชลบุรีใหม่ W121,5/13/23,2023-05-13T00:00:00.000Z,2023,5,13,,100%Mandarin Orange Malee 200ml 3x8 Leaf,,BRI,,105.0,Fruit Juice,Orange-Mandarin,3*8,200 ml
7 - Eleven,ศูนย์กระจายสินค้า RDC สุราษฏร์ธานี,5/13/23,2023-05-13T00:00:00.000Z,2023,5,13,,100%Mandarin Orange Malee 200ml 3x8 Leaf,,BRI,,63.0,Fruit Juice,Orange-Mandarin,3*8,200 ml
7 - Eleven,ศูนย์กระจายสินค้า RDC WESTมหาชัย,5/13/23,2023-05-13T00:00:00.000Z,2023,5,13,,100%Mandarin Orange Malee 200ml 3x8 Leaf,,BRI,,168.0,Fruit Juice,Orange-Mandarin,3*8,200 ml
7 - Eleven,ศุนย์กระจายสินค้า นครสวรรค์(RDC นครสวรรค์),5/13/23,2023-05-13T00:00:00.000Z,2023,5,13,,100%Mandarin Orange Malee 200ml 3x8 Leaf,,BRI,,147.0,Fruit Juice,Orange-Mandarin,3*8,200 ml
7 - Eleven,บริษัท ซีพี ออลล์ จำกัด (มหาชน),5/13/23,2023-05-13T00:00:00.000Z,2023,5,13,,100%Mandarin Orange Malee 200ml 3x8 Leaf,,BRI,,304.0,Fruit Juice,Orange-Mandarin,3*8,200 ml
7 - Eleven,ศูนย์กระจายสินค้าขอนแก่น (W801),5/16/23,2023-05-16T00:00:00.000Z,2023,5,16,,100%Mandarin Orange Malee 200ml 3x8 Leaf,,BRI,,42.0,Fruit Juice,Orange-Mandarin,3*8,200 ml
7 - Eleven,ศูนย์กระจายสินค้า RDCชลบุรีใหม่ W121,5/16/23,2023-05-16T00:00:00.000Z,2023,5,16,,100%Mandarin Orange Malee 200ml 3x8 Leaf,,BRI,,168.0,Fruit Juice,Orange-Mandarin,3*8,200 ml
7 - Eleven,ศูนย์กระจายสินค้า DC5 สุวรรณภูมิ,5/16/23,2023-05-16T00:00:00.000Z,2023,5,16,,100%Mandarin Orange Malee 200ml 3x8 Leaf,,BRI,,168.0,Fruit Juice,Orange-Mandarin,3*8,200 ml
7 - Eleven,ศุนย์กระจายสินค้า นครสวรรค์(RDC นครสวรรค์),5/16/23,2023-05-16T00:00:00.000Z,2023,5,16,,100%Mandarin Orange Malee 200ml 3x8 Leaf,,BRI,,42.0,Fruit Juice,Orange-Mandarin,3*8,200 ml
7 - Eleven,บริษัท ซีพี ออลล์ จำกัด (มหาชน),5/16/23,2023-05-16T00:00:00.000Z,2023,5,16,,100%Mandarin Orange Malee 200ml 3x8 Leaf,,BRI,,144.0,Fruit Juice,Orange-Mandarin,3*8,200 ml
7 - Eleven,ศูนย์กระจายสินค้า RDCชลบุรีใหม่ W121,5/17/23,2023-05-17T00:00:00.000Z,2023,5,17,,100%Mandarin Orange Malee 200ml 3x8 Leaf,,BRI,,42.0,Fruit Juice,Orange-Mandarin,3*8,200 ml
7 - Eleven,ศูนย์กระจายสินค้า RDC สุราษฏร์ธานี,5/17/23,2023-05-17T00:00:00.000Z,2023,5,17,,100%Mandarin Orange Malee 200ml 3x8 Leaf,,BRI,,168.0,Fruit Juice,Orange-Mandarin,3*8,200 ml
7 - Eleven,ศูนย์กระจายสินค้า RDC WESTมหาชัย,5/17/23,2023-05-17T00:00:00.000Z,2023,5,17,,100%Mandarin Orange Malee 200ml 3x8 Leaf,,BRI,,63.0,Fruit Juice,Orange-Mandarin,3*8,200 ml
7 - Eleven,ศุนย์กระจายสินค้า หาดใหญ่(RDC หาดใหญ่),5/17/23,2023-05-17T00:00:00.000Z,2023,5,17,,100%Mandarin Orange Malee 200ml 3x8 Leaf,,BRI,,42.0,Fruit Juice,Orange-Mandarin,3*8,200 ml
7 - Eleven,ศูนย์กระจายสินค้าขอนแก่น (W801),5/18/23,2023-05-18T00:00:00.000Z,2023,5,18,,100%Mandarin Orange Malee 200ml 3x8 Leaf,,BRI,,42.0,Fruit Juice,Orange-Mandarin,3*8,200 ml
7 - Eleven,ศูนย์กระจายสินค้า DC5 สุวรรณภูมิ,5/18/23,2023-05-18T00:00:00.000Z,2023,5,18,,100%Mandarin Orange Malee 200ml 3x8 Leaf,,BRI,,84.0,Fruit Juice,Orange-Mandarin,3*8,200 ml
7 - Eleven,บริษัท ซีพี ออลล์ จำกัด (มหาชน),5/18/23,2023-05-18T00:00:00.000Z,2023,5,18,,100%Mandarin Orange Malee 200ml 3x8 Leaf,,BRI,,207.0,Fruit Juice,Orange-Mandarin,3*8,200 ml
7 - Eleven,ศูนย์กระจายสินค้า RDCชลบุรีใหม่ W121,5/19/23,2023-05-19T00:00:00.000Z,2023,5,19,,100%Mandarin Orange Malee 200ml 3x8 Leaf,,BRI,,84.0,Fruit Juice,Orange-Mandarin,3*8,200 ml
7 - Eleven,ศูนย์กระจายสินค้า RDC WESTมหาชัย,5/19/23,2023-05-19T00:00:00.000Z,2023,5,19,,100%Mandarin Orange Malee 200ml 3x8 Leaf,,BRI,,21.0,Fruit Juice,Orange-Mandarin,3*8,200 ml
7 - Eleven,ศูนย์กระจายสินค้า DC5 สุวรรณภูมิ,5/19/23,2023-05-19T00:00:00.000Z,2023,5,19,,100%Mandarin Orange Malee 200ml 3x8 Leaf,,BRI,,84.0,Fruit Juice,Orange-Mandarin,3*8,200 ml
7 - Eleven,บริษัท ซีพี ออลล์ จำกัด (มหาชน),5/19/23,2023-05-19T00:00:00.000Z,2023,5,19,,100%Mandarin Orange Malee 200ml 3x8 Leaf,,BRI,,144.0,Fruit Juice,Orange-Mandarin,3*8,200 ml
7 - Eleven,ศูนย์กระจายสินค้าขอนแก่น (W801),5/22/23,2023-05-22T00:00:00.000Z,2023,5,22,,100%Mandarin Orange Malee 200ml 3x8 Leaf,,BRI,,20.0,Fruit Juice,Orange-Mandarin,3*8,200 ml
7 - Eleven,ศูนย์กระจายสินค้า RDCชลบุรีใหม่ W121,5/22/23,2023-05-22T00:00:00.000Z,2023,5,22,,100%Mandarin Orange Malee 200ml 3x8 Leaf,,BRI,,273.0,Fruit Juice,Orange-Mandarin,3*8,200 ml
7 - Eleven,ศูนย์กระจายสินค้า RDC สุราษฏร์ธานี,5/22/23,2023-05-22T00:00:00.000Z,2023,5,22,,100%Mandarin Orange Malee 200ml 3x8 Leaf,,BRI,,84.0,Fruit Juice,Orange-Mandarin,3*8,200 ml
7 - Eleven,ศูนย์กระจายสินค้า RDC WESTมหาชัย,5/22/23,2023-05-22T00:00:00.000Z,2023,5,22,,100%Mandarin Orange Malee 200ml 3x8 Leaf,,BRI,,168.0,Fruit Juice,Orange-Mandarin,3*8,200 ml
7 - Eleven,ศูนย์กระจายสินค้า DC5 สุวรรณภูมิ,5/22/23,2023-05-22T00:00:00.000Z,2023,5,22,,100%Mandarin Orange Malee 200ml 3x8 Leaf,,BRI,,210.0,Fruit Juice,Orange-Mandarin,3*8,200 ml
7 - Eleven,ศุนย์กระจายสินค้า หาดใหญ่(RDC หาดใหญ่),5/22/23,2023-05-22T00:00:00.000Z,2023,5,22,,100%Mandarin Orange Malee 200ml 3x8 Leaf,,BRI,,20.0,Fruit Juice,Orange-Mandarin,3*8,200 ml
7 - Eleven,ศุนย์กระจายสินค้า นครสวรรค์(RDC นครสวรรค์),5/22/23,2023-05-22T00:00:00.000Z,2023,5,22,,100%Mandarin Orange Malee 200ml 3x8 Leaf,,BRI,,83.0,Fruit Juice,Orange-Mandarin,3*8,200 ml
7 - Eleven,บริษัท ซีพี ออลล์ จำกัด (มหาชน),5/22/23,2023-05-22T00:00:00.000Z,2023,5,22,,100%Mandarin Orange Malee 200ml 3x8 Leaf,,BRI,,436.0,Fruit Juice,Orange-Mandarin,3*8,200 ml
7 - Eleven,ศูนย์กระจายสินค้าขอนแก่น (W801),5/23/23,2023-05-23T00:00:00.000Z,2023,5,23,,100%Mandarin Orange Malee 200ml 3x8 Leaf,,BRI,,168.0,Fruit Juice,Orange-Mandarin,3*8,200 ml
7 - Eleven,ศูนย์กระจายสินค้า RDCชลบุรีใหม่ W121,5/23/23,2023-05-23T00:00:00.000Z,2023,5,23,,100%Mandarin Orange Malee 200ml 3x8 Leaf,,BRI,,42.0,Fruit Juice,Orange-Mandarin,3*8,200 ml
7 - Eleven,ศูนย์กระจายสินค้า DC5 สุวรรณภูมิ,5/23/23,2023-05-23T00:00:00.000Z,2023,5,23,,100%Mandarin Orange Malee 200ml 3x8 Leaf,,BRI,,42.0,Fruit Juice,Orange-Mandarin,3*8,200 ml
7 - Eleven,ศุนย์กระจายสินค้า นครสวรรค์(RDC นครสวรรค์),5/23/23,2023-05-23T00:00:00.000Z,2023,5,23,,100%Mandarin Orange Malee 200ml 3x8 Leaf,,BRI,,147.0,Fruit Juice,Orange-Mandarin,3*8,200 ml
7 - Eleven,บริษัท ซีพี ออลล์ จำกัด (มหาชน),5/23/23,2023-05-23T00:00:00.000Z,2023,5,23,,100%Mandarin Orange Malee 200ml 3x8 Leaf,,BRI,,160.0,Fruit Juice,Orange-Mandarin,3*8,200 ml
7 - Eleven,ศูนย์กระจายสินค้า RDC สุราษฏร์ธานี,5/24/23,2023-05-24T00:00:00.000Z,2023,5,24,,100%Mandarin Orange Malee 200ml 3x8 Leaf,,BRI,,126.0,Fruit Juice,Orange-Mandarin,3*8,200 ml
7 - Eleven,ศูนย์กระจายสินค้า RDC WESTมหาชัย,5/24/23,2023-05-24T00:00:00.000Z,2023,5,24,,100%Mandarin Orange Malee 200ml 3x8 Leaf,,BRI,,168.0,Fruit Juice,Orange-Mandarin,3*8,200 ml
7 - Eleven,ศูนย์กระจายสินค้า DC5 สุวรรณภูมิ,5/24/23,2023-05-24T00:00:00.000Z,2023,5,24,,100%Mandarin Orange Malee 200ml 3x8 Leaf,,BRI,,168.0,Fruit Juice,Orange-Mandarin,3*8,200 ml
7 - Eleven,ศุนย์กระจายสินค้า หาดใหญ่(RDC หาดใหญ่),5/24/23,2023-05-24T00:00:00.000Z,2023,5,24,,100%Mandarin Orange Malee 200ml 3x8 Leaf,,BRI,,42.0,Fruit Juice,Orange-Mandarin,3*8,200 ml
7 - Eleven,ศูนย์กระจายสินค้า RDCชลบุรีใหม่ W121,5/26/23,2023-05-26T00:00:00.000Z,2023,5,26,,100%Mandarin Orange Malee 200ml 3x8 Leaf,,BRI,,42.0,Fruit Juice,Orange-Mandarin,3*8,200 ml
7 - Eleven,ศูนย์กระจายสินค้า DC5 สุวรรณภูมิ,5/26/23,2023-05-26T00:00:00.000Z,2023,5,26,,100%Mandarin Orange Malee 200ml 3x8 Leaf,,BRI,,168.0,Fruit Juice,Orange-Mandarin,3*8,200 ml
7 - Eleven,บริษัท ซีพี ออลล์ จำกัด (มหาชน),5/26/23,2023-05-26T00:00:00.000Z,2023,5,26,,100%Mandarin Orange Malee 200ml 3x8 Leaf,,BRI,,263.0,Fruit Juice,Orange-Mandarin,3*8,200 ml
7 - Eleven,ศูนย์กระจายสินค้าขอนแก่น (W801),5/27/23,2023-05-27T00:00:00.000Z,2023,5,27,,100%Mandarin Orange Malee 200ml 3x8 Leaf,,BRI,,168.0,Fruit Juice,Orange-Mandarin,3*8,200 ml
7 - Eleven,ศูนย์กระจายสินค้า RDCชลบุรีใหม่ W121,5/27/23,2023-05-27T00:00:00.000Z,2023,5,27,,100%Mandarin Orange Malee 200ml 3x8 Leaf,,BRI,,105.0,Fruit Juice,Orange-Mandarin,3*8,200 ml
7 - Eleven,ศูนย์กระจายสินค้า RDC สุราษฏร์ธานี,5/27/23,2023-05-27T00:00:00.000Z,2023,5,27,,100%Mandarin Orange Malee 200ml 3x8 Leaf,,BRI,,42.0,Fruit Juice,Orange-Mandarin,3*8,200 ml
7 - Eleven,ศูนย์กระจายสินค้า RDC WESTมหาชัย,5/27/23,2023-05-27T00:00:00.000Z,2023,5,27,,100%Mandarin Orange Malee 200ml 3x8 Leaf,,BRI,,168.0,Fruit Juice,Orange-Mandarin,3*8,200 ml
7 - Eleven,ศูนย์กระจายสินค้า DC5 สุวรรณภูมิ,5/27/23,2023-05-27T00:00:00.000Z,2023,5,27,,100%Mandarin Orange Malee 200ml 3x8 Leaf,,BRI,,168.0,Fruit Juice,Orange-Mandarin,3*8,200 ml
7 - Eleven,ศุนย์กระจายสินค้า หาดใหญ่(RDC หาดใหญ่),5/27/23,2023-05-27T00:00:00.000Z,2023,5,27,,100%Mandarin Orange Malee 200ml 3x8 Leaf,,BRI,,63.0,Fruit Juice,Orange-Mandarin,3*8,200 ml
7 - Eleven,ศุนย์กระจายสินค้า นครสวรรค์(RDC นครสวรรค์),5/27/23,2023-05-27T00:00:00.000Z,2023,5,27,,100%Mandarin Orange Malee 200ml 3x8 Leaf,,BRI,,147.0,Fruit Juice,Orange-Mandarin,3*8,200 ml
7 - Eleven,บริษัท ซีพี ออลล์ จำกัด (มหาชน),5/27/23,2023-05-27T00:00:00.000Z,2023,5,27,,100%Mandarin Orange Malee 200ml 3x8 Leaf,,BRI,,20.0,Fruit Juice,Orange-Mandarin,3*8,200 ml
7 - Eleven,ศูนย์กระจายสินค้า RDCชลบุรีใหม่ W121,5/29/23,2023-05-29T00:00:00.000Z,2023,5,29,,100%Mandarin Orange Malee 200ml 3x8 Leaf,,BRI,,168.0,Fruit Juice,Orange-Mandarin,3*8,200 ml
7 - Eleven,ศูนย์กระจายสินค้า RDC WESTมหาชัย,5/29/23,2023-05-29T00:00:00.000Z,2023,5,29,,100%Mandarin Orange Malee 200ml 3x8 Leaf,,BRI,,42.0,Fruit Juice,Orange-Mandarin,3*8,200 ml
7 - Eleven,บริษัท ซีพี ออลล์ จำกัด (มหาชน),5/29/23,2023-05-29T00:00:00.000Z,2023,5,29,,100%Mandarin Orange Malee 200ml 3x8 Leaf,,BRI,,231.0,Fruit Juice,Orange-Mandarin,3*8,200 ml
7 - Eleven,ศูนย์กระจายสินค้า RDCชลบุรีใหม่ W121,5/30/23,2023-05-30T00:00:00.000Z,2023,5,30,,100%Mandarin Orange Malee 200ml 3x8 Leaf,,BRI,,84.0,Fruit Juice,Orange-Mandarin,3*8,200 ml
7 - Eleven,ศูนย์กระจายสินค้า RDC WESTมหาชัย,5/30/23,2023-05-30T00:00:00.000Z,2023,5,30,,100%Mandarin Orange Malee 200ml 3x8 Leaf,,BRI,,42.0,Fruit Juice,Orange-Mandarin,3*8,200 ml
7 - Eleven,ศูนย์กระจายสินค้า DC5 สุวรรณภูมิ,5/30/23,2023-05-30T00:00:00.000Z,2023,5,30,,100%Mandarin Orange Malee 200ml 3x8 Leaf,,BRI,,168.0,Fruit Juice,Orange-Mandarin,3*8,200 ml
7 - Eleven,ศุนย์กระจายสินค้า นครสวรรค์(RDC นครสวรรค์),5/30/23,2023-05-30T00:00:00.000Z,2023,5,30,,100%Mandarin Orange Malee 200ml 3x8 Leaf,,BRI,,210.0,Fruit Juice,Orange-Mandarin,3*8,200 ml
7 - Eleven,บริษัท ซีพี ออลล์ จำกัด (มหาชน),5/30/23,2023-05-30T00:00:00.000Z,2023,5,30,,100%Mandarin Orange Malee 200ml 3x8 Leaf,,BRI,,408.0,Fruit Juice,Orange-Mandarin,3*8,200 ml
7 - Eleven,ศูนย์กระจายสินค้า RDC สุราษฏร์ธานี,5/31/23,2023-05-31T00:00:00.000Z,2023,5,31,,100%Mandarin Orange Malee 200ml 3x8 Leaf,,BRI,,168.0,Fruit Juice,Orange-Mandarin,3*8,200 ml
7 - Eleven,ศูนย์กระจายสินค้า DC5 สุวรรณภูมิ,5/31/23,2023-05-31T00:00:00.000Z,2023,5,31,,100%Mandarin Orange Malee 200ml 3x8 Leaf,,BRI,,84.0,Fruit Juice,Orange-Mandarin,3*8,200 ml
7 - Eleven,ศุนย์กระจายสินค้า หาดใหญ่(RDC หาดใหญ่),5/31/23,2023-05-31T00:00:00.000Z,2023,5,31,,100%Mandarin Orange Malee 200ml 3x8 Leaf,,BRI,,84.0,Fruit Juice,Orange-Mandarin,3*8,200 ml
7 - Eleven,บริษัท ซีพี ออลล์ จำกัด (มหาชน),5/31/23,2023-05-31T00:00:00.000Z,2023,5,31,,100%Mandarin Orange Malee 200ml 3x8 Leaf,,BRI,,144.0,Fruit Juice,Orange-Mandarin,3*8,200 ml
7 - Eleven,ศูนย์กระจายสินค้าขอนแก่น (W801),6/1/23,2023-06-01T00:00:00.000Z,2023,6,1,,100%Mandarin Orange Malee 200ml 3x8 Leaf,,BRI,,168.0,Fruit Juice,Orange-Mandarin,3*8,200 ml
7 - Eleven,ศูนย์กระจายสินค้า RDCชลบุรีใหม่ W121,6/1/23,2023-06-01T00:00:00.000Z,2023,6,1,,100%Mandarin Orange Malee 200ml 3x8 Leaf,,BRI,,105.0,Fruit Juice,Orange-Mandarin,3*8,200 ml
7 - Eleven,ศูนย์กระจายสินค้า RDC WESTมหาชัย,6/1/23,2023-06-01T00:00:00.000Z,2023,6,1,,100%Mandarin Orange Malee 200ml 3x8 Leaf,,BRI,,63.0,Fruit Juice,Orange-Mandarin,3*8,200 ml
7 - Eleven,ศูนย์กระจายสินค้า DC5 สุวรรณภูมิ,6/1/23,2023-06-01T00:00:00.000Z,2023,6,1,,100%Mandarin Orange Malee 200ml 3x8 Leaf,,BRI,,105.0,Fruit Juice,Orange-Mandarin,3*8,200 ml
7 - Eleven,บริษัท ซีพี ออลล์ จำกัด (มหาชน),6/1/23,2023-06-01T00:00:00.000Z,2023,6,1,,100%Mandarin Orange Malee 200ml 3x8 Leaf,,BRI,,123.0,Fruit Juice,Orange-Mandarin,3*8,200 ml
7 - Eleven,ศูนย์กระจายสินค้า RDCชลบุรีใหม่ W121,6/2/23,2023-06-02T00:00:00.000Z,2023,6,2,,100%Mandarin Orange Malee 200ml 3x8 Leaf,,BRI,,84.0,Fruit Juice,Orange-Mandarin,3*8,200 ml
7 - Eleven,ศูนย์กระจายสินค้า RDC WESTมหาชัย,6/2/23,2023-06-02T00:00:00.000Z,2023,6,2,,100%Mandarin Orange Malee 200ml 3x8 Leaf,,BRI,,168.0,Fruit Juice,Orange-Mandarin,3*8,200 ml
7 - Eleven,ศูนย์กระจายสินค้า DC5 สุวรรณภูมิ,6/2/23,2023-06-02T00:00:00.000Z,2023,6,2,,100%Mandarin Orange Malee 200ml 3x8 Leaf,,BRI,,168.0,Fruit Juice,Orange-Mandarin,3*8,200 ml
7 - Eleven,บริษัท ซีพี ออลล์ จำกัด (มหาชน),6/2/23,2023-06-02T00:00:00.000Z,2023,6,2,,100%Mandarin Orange Malee 200ml 3x8 Leaf,,BRI,,288.0,Fruit Juice,Orange-Mandarin,3*8,200 ml
7 - Eleven,ศูนย์กระจายสินค้า RDCชลบุรีใหม่ W121,6/3/23,2023-06-03T00:00:00.000Z,2023,6,3,,100%Mandarin Orange Malee 200ml 3x8 Leaf,,BRI,,105.0,Fruit Juice,Orange-Mandarin,3*8,200 ml
7 - Eleven,ศูนย์กระจายสินค้า RDC สุราษฏร์ธานี,6/3/23,2023-06-03T00:00:00.000Z,2023,6,3,,100%Mandarin Orange Malee 200ml 3x8 Leaf,,BRI,,63.0,Fruit Juice,Orange-Mandarin,3*8,200 ml
7 - Eleven,ศูนย์กระจายสินค้า RDC WESTมหาชัย,6/3/23,2023-06-03T00:00:00.000Z,2023,6,3,,100%Mandarin Orange Malee 200ml 3x8 Leaf,,BRI,,168.0,Fruit Juice,Orange-Mandarin,3*8,200 ml
7 - Eleven,ศูนย์กระจายสินค้า DC5 สุวรรณภูมิ,6/3/23,2023-06-03T00:00:00.000Z,2023,6,3,,100%Mandarin Orange Malee 200ml 3x8 Leaf,,BRI,,168.0,Fruit Juice,Orange-Mandarin,3*8,200 ml
7 - Eleven,ศุนย์กระจายสินค้า หาดใหญ่(RDC หาดใหญ่),6/3/23,2023-06-03T00:00:00.000Z,2023,6,3,,100%Mandarin Orange Malee 200ml 3x8 Leaf,,BRI,,126.0,Fruit Juice,Orange-Mandarin,3*8,200 ml
7 - Eleven,ศุนย์กระจายสินค้า นครสวรรค์(RDC นครสวรรค์),6/3/23,2023-06-03T00:00:00.000Z,2023,6,3,,100%Mandarin Orange Malee 200ml 3x8 Leaf,,BRI,,63.0,Fruit Juice,Orange-Mandarin,3*8,200 ml
7 - Eleven,บริษัท ซีพี ออลล์ จำกัด (มหาชน),6/3/23,2023-06-03T00:00:00.000Z,2023,6,3,,100%Mandarin Orange Malee 200ml 3x8 Leaf,,BRI,,20.0,Fruit Juice,Orange-Mandarin,3*8,200 ml
7 - Eleven,ศูนย์กระจายสินค้า RDCชลบุรีใหม่ W121,6/5/23,2023-06-05T00:00:00.000Z,2023,6,5,,100%Mandarin Orange Malee 200ml 3x8 Leaf,,BRI,,168.0,Fruit Juice,Orange-Mandarin,3*8,200 ml
7 - Eleven,บริษัท ซีพี ออลล์ จำกัด (มหาชน),6/5/23,2023-06-05T00:00:00.000Z,2023,6,5,,100%Mandarin Orange Malee 200ml 3x8 Leaf,,BRI,,294.0,Fruit Juice,Orange-Mandarin,3*8,200 ml
7 - Eleven,ศูนย์กระจายสินค้าขอนแก่น (W801),6/6/23,2023-06-06T00:00:00.000Z,2023,6,6,,100%Mandarin Orange Malee 200ml 3x8 Leaf,,BRI,,84.0,Fruit Juice,Orange-Mandarin,3*8,200 ml
7 - Eleven,ศุนย์กระจายสินค้า นครสวรรค์(RDC นครสวรรค์),6/6/23,2023-06-06T00:00:00.000Z,2023,6,6,,100%Mandarin Orange Malee 200ml 3x8 Leaf,,BRI,,147.0,Fruit Juice,Orange-Mandarin,3*8,200 ml
7 - Eleven,บริษัท ซีพี ออลล์ จำกัด (มหาชน),6/6/23,2023-06-06T00:00:00.000Z,2023,6,6,,100%Mandarin Orange Malee 200ml 3x8 Leaf,,BRI,,344.0,Fruit Juice,Orange-Mandarin,3*8,200 ml
7 - Eleven,ศูนย์กระจายสินค้า RDCชลบุรีใหม่ W121,6/7/23,2023-06-07T00:00:00.000Z,2023,6,7,,100%Mandarin Orange Malee 200ml 3x8 Leaf,,BRI,,63.0,Fruit Juice,Orange-Mandarin,3*8,200 ml
7 - Eleven,ศูนย์กระจายสินค้า RDC สุราษฏร์ธานี,6/7/23,2023-06-07T00:00:00.000Z,2023,6,7,,100%Mandarin Orange Malee 200ml 3x8 Leaf,,BRI,,189.0,Fruit Juice,Orange-Mandarin,3*8,200 ml
7 - Eleven,ศูนย์กระจายสินค้า RDC WESTมหาชัย,6/7/23,2023-06-07T00:00:00.000Z,2023,6,7,,100%Mandarin Orange Malee 200ml 3x8 Leaf,,BRI,,168.0,Fruit Juice,Orange-Mandarin,3*8,200 ml
7 - Eleven,ศูนย์กระจายสินค้า DC5 สุวรรณภูมิ,6/7/23,2023-06-07T00:00:00.000Z,2023,6,7,,100%Mandarin Orange Malee 200ml 3x8 Leaf,,BRI,,63.0,Fruit Juice,Orange-Mandarin,3*8,200 ml
7 - Eleven,ศุนย์กระจายสินค้า หาดใหญ่(RDC หาดใหญ่),6/7/23,2023-06-07T00:00:00.000Z,2023,6,7,,100%Mandarin Orange Malee 200ml 3x8 Leaf,,BRI,,84.0,Fruit Juice,Orange-Mandarin,3*8,200 ml
7 - Eleven,บริษัท ซีพี ออลล์ จำกัด (มหาชน),6/7/23,2023-06-07T00:00:00.000Z,2023,6,7,,100%Mandarin Orange Malee 200ml 3x8 Leaf,,BRI,,144.0,Fruit Juice,Orange-Mandarin,3*8,200 ml
7 - Eleven,ศูนย์กระจายสินค้าขอนแก่น (W801),6/8/23,2023-06-08T00:00:00.000Z,2023,6,8,,100%Mandarin Orange Malee 200ml 3x8 Leaf,,BRI,,126.0,Fruit Juice,Orange-Mandarin,3*8,200 ml
7 - Eleven,ศูนย์กระจายสินค้า RDCชลบุรีใหม่ W121,6/8/23,2023-06-08T00:00:00.000Z,2023,6,8,,100%Mandarin Orange Malee 200ml 3x8 Leaf,,BRI,,42.0,Fruit Juice,Orange-Mandarin,3*8,200 ml
7 - Eleven,ศูนย์กระจายสินค้า DC5 สุวรรณภูมิ,6/8/23,2023-06-08T00:00:00.000Z,2023,6,8,,100%Mandarin Orange Malee 200ml 3x8 Leaf,,BRI,,84.0,Fruit Juice,Orange-Mandarin,3*8,200 ml
7 - Eleven,ศุนย์กระจายสินค้า นครสวรรค์(RDC นครสวรรค์),6/8/23,2023-06-08T00:00:00.000Z,2023,6,8,,100%Mandarin Orange Malee 200ml 3x8 Leaf,,BRI,,210.0,Fruit Juice,Orange-Mandarin,3*8,200 ml
7 - Eleven,บริษัท ซีพี ออลล์ จำกัด (มหาชน),6/8/23,2023-06-08T00:00:00.000Z,2023,6,8,,100%Mandarin Orange Malee 200ml 3x8 Leaf,,BRI,,40.0,Fruit Juice,Orange-Mandarin,3*8,200 ml
7 - Eleven,ศูนย์กระจายสินค้า RDCชลบุรีใหม่ W121,6/9/23,2023-06-09T00:00:00.000Z,2023,6,9,,100%Mandarin Orange Malee 200ml 3x8 Leaf,,BRI,,63.0,Fruit Juice,Orange-Mandarin,3*8,200 ml
7 - Eleven,ศูนย์กระจายสินค้า DC5 สุวรรณภูมิ,6/9/23,2023-06-09T00:00:00.000Z,2023,6,9,,100%Mandarin Orange Malee 200ml 3x8 Leaf,,BRI,,168.0,Fruit Juice,Orange-Mandarin,3*8,200 ml
7 - Eleven,ศูนย์กระจายสินค้าขอนแก่น (W801),6/10/23,2023-06-10T00:00:00.000Z,2023,6,10,,100%Mandarin Orange Malee 200ml 3x8 Leaf,,BRI,,105.0,Fruit Juice,Orange-Mandarin,3*8,200 ml
7 - Eleven,ศูนย์กระจายสินค้า RDCชลบุรีใหม่ W121,6/10/23,2023-06-10T00:00:00.000Z,2023,6,10,,100%Mandarin Orange Malee 200ml 3x8 Leaf,,BRI,,126.0,Fruit Juice,Orange-Mandarin,3*8,200 ml
7 - Eleven,ศูนย์กระจายสินค้า RDC สุราษฏร์ธานี,6/10/23,2023-06-10T00:00:00.000Z,2023,6,10,,100%Mandarin Orange Malee 200ml 3x8 Leaf,,BRI,,42.0,Fruit Juice,Orange-Mandarin,3*8,200 ml
7 - Eleven,ศูนย์กระจายสินค้า RDC WESTมหาชัย,6/10/23,2023-06-10T00:00:00.000Z,2023,6,10,,100%Mandarin Orange Malee 200ml 3x8 Leaf,,BRI,,84.0,Fruit Juice,Orange-Mandarin,3*8,200 ml
7 - Eleven,ศูนย์กระจายสินค้า DC5 สุวรรณภูมิ,6/10/23,2023-06-10T00:00:00.000Z,2023,6,10,,100%Mandarin Orange Malee 200ml 3x8 Leaf,,BRI,,126.0,Fruit Juice,Orange-Mandarin,3*8,200 ml
7 - Eleven,ศุนย์กระจายสินค้า หาดใหญ่(RDC หาดใหญ่),6/10/23,2023-06-10T00:00:00.000Z,2023,6,10,,100%Mandarin Orange Malee 200ml 3x8 Leaf,,BRI,,21.0,Fruit Juice,Orange-Mandarin,3*8,200 ml
7 - Eleven,บริษัท ซีพี ออลล์ จำกัด (มหาชน),6/10/23,2023-06-10T00:00:00.000Z,2023,6,10,,100%Mandarin Orange Malee 200ml 3x8 Leaf,,BRI,,288.0,Fruit Juice,Orange-Mandarin,3*8,200 ml
7 - Eleven,ศูนย์กระจายสินค้า RDCชลบุรีใหม่ W121,6/12/23,2023-06-12T00:00:00.000Z,2023,6,12,,100%Mandarin Orange Malee 200ml 3x8 Leaf,,BRI,,63.0,Fruit Juice,Orange-Mandarin,3*8,200 ml
7 - Eleven,ศูนย์กระจายสินค้า RDC WESTมหาชัย,6/12/23,2023-06-12T00:00:00.000Z,2023,6,12,,100%Mandarin Orange Malee 200ml 3x8 Leaf,,BRI,,168.0,Fruit Juice,Orange-Mandarin,3*8,200 ml
7 - Eleven,บริษัท ซีพี ออลล์ จำกัด (มหาชน),6/12/23,2023-06-12T00:00:00.000Z,2023,6,12,,100%Mandarin Orange Malee 200ml 3x8 Leaf,,BRI,,312.0,Fruit Juice,Orange-Mandarin,3*8,200 ml
7 - Eleven,ศูนย์กระจายสินค้าขอนแก่น (W801),6/13/23,2023-06-13T00:00:00.000Z,2023,6,13,,100%Mandarin Orange Malee 200ml 3x8 Leaf,,BRI,,105.0,Fruit Juice,Orange-Mandarin,3*8,200 ml
7 - Eleven,ศูนย์กระจายสินค้า RDCชลบุรีใหม่ W121,6/13/23,2023-06-13T00:00:00.000Z,2023,6,13,,100%Mandarin Orange Malee 200ml 3x8 Leaf,,BRI,,63.0,Fruit Juice,Orange-Mandarin,3*8,200 ml
7 - Eleven,ศูนย์กระจายสินค้า DC5 สุวรรณภูมิ,6/13/23,2023-06-13T00:00:00.000Z,2023,6,13,,100%Mandarin Orange Malee 200ml 3x8 Leaf,,BRI,,126.0,Fruit Juice,Orange-Mandarin,3*8,200 ml
7 - Eleven,ศุนย์กระจายสินค้า นครสวรรค์(RDC นครสวรรค์),6/13/23,2023-06-13T00:00:00.000Z,2023,6,13,,100%Mandarin Orange Malee 200ml 3x8 Leaf,,BRI,,147.0,Fruit Juice,Orange-Mandarin,3*8,200 ml
7 - Eleven,บริษัท ซีพี ออลล์ จำกัด (มหาชน),6/13/23,2023-06-13T00:00:00.000Z,2023,6,13,,100%Mandarin Orange Malee 200ml 3x8 Leaf,,BRI,,160.0,Fruit Juice,Orange-Mandarin,3*8,200 ml
7 - Eleven,ศูนย์กระจายสินค้า RDCชลบุรีใหม่ W121,6/14/23,2023-06-14T00:00:00.000Z,2023,6,14,,100%Mandarin Orange Malee 200ml 3x8 Leaf,,BRI,,63.0,Fruit Juice,Orange-Mandarin,3*8,200 ml
7 - Eleven,ศูนย์กระจายสินค้า RDC สุราษฏร์ธานี,6/14/23,2023-06-14T00:00:00.000Z,2023,6,14,,100%Mandarin Orange Malee 200ml 3x8 Leaf,,BRI,,147.0,Fruit Juice,Orange-Mandarin,3*8,200 ml
7 - Eleven,ศูนย์กระจายสินค้า DC5 สุวรรณภูมิ,6/14/23,2023-06-14T00:00:00.000Z,2023,6,14,,100%Mandarin Orange Malee 200ml 3x8 Leaf,,BRI,,105.0,Fruit Juice,Orange-Mandarin,3*8,200 ml
7 - Eleven,ศุนย์กระจายสินค้า หาดใหญ่(RDC หาดใหญ่),6/14/23,2023-06-14T00:00:00.000Z,2023,6,14,,100%Mandarin Orange Malee 200ml 3x8 Leaf,,BRI,,84.0,Fruit Juice,Orange-Mandarin,3*8,200 ml
7 - Eleven,ศูนย์กระจายสินค้า RDCชลบุรีใหม่ W121,6/15/23,2023-06-15T00:00:00.000Z,2023,6,15,,100%Mandarin Orange Malee 200ml 3x8 Leaf,,BRI,,63.0,Fruit Juice,Orange-Mandarin,3*8,200 ml
7 - Eleven,ศูนย์กระจายสินค้า RDC WESTมหาชัย,6/15/23,2023-06-15T00:00:00.000Z,2023,6,15,,100%Mandarin Orange Malee 200ml 3x8 Leaf,,BRI,,42.0,Fruit Juice,Orange-Mandarin,3*8,200 ml
7 - Eleven,ศูนย์กระจายสินค้า DC5 สุวรรณภูมิ,6/15/23,2023-06-15T00:00:00.000Z,2023,6,15,,100%Mandarin Orange Malee 200ml 3x8 Leaf,,BRI,,105.0,Fruit Juice,Orange-Mandarin,3*8,200 ml
7 - Eleven,บริษัท ซีพี ออลล์ จำกัด (มหาชน),6/15/23,2023-06-15T00:00:00.000Z,2023,6,15,,100%Mandarin Orange Malee 200ml 3x8 Leaf,,BRI,,391.0,Fruit Juice,Orange-Mandarin,3*8,200 ml
7 - Eleven,ศูนย์กระจายสินค้า RDCชลบุรีใหม่ W121,6/16/23,2023-06-16T00:00:00.000Z,2023,6,16,,100%Mandarin Orange Malee 200ml 3x8 Leaf,,BRI,,84.0,Fruit Juice,Orange-Mandarin,3*8,200 ml
7 - Eleven,ศูนย์กระจายสินค้า DC5 สุวรรณภูมิ,6/16/23,2023-06-16T00:00:00.000Z,2023,6,16,,100%Mandarin Orange Malee 200ml 3x8 Leaf,,BRI,,63.0,Fruit Juice,Orange-Mandarin,3*8,200 ml
7 - Eleven,บริษัท ซีพี ออลล์ จำกัด (มหาชน),6/16/23,2023-06-16T00:00:00.000Z,2023,6,16,,100%Mandarin Orange Malee 200ml 3x8 Leaf,,BRI,,144.0,Fruit Juice,Orange-Mandarin,3*8,200 ml
7 - Eleven,ศูนย์กระจายสินค้าขอนแก่น (W801),6/17/23,2023-06-17T00:00:00.000Z,2023,6,17,,100%Mandarin Orange Malee 200ml 3x8 Leaf,,BRI,,21.0,Fruit Juice,Orange-Mandarin,3*8,200 ml
7 - Eleven,ศูนย์กระจายสินค้า RDCชลบุรีใหม่ W121,6/17/23,2023-06-17T00:00:00.000Z,2023,6,17,,100%Mandarin Orange Malee 200ml 3x8 Leaf,,BRI,,126.0,Fruit Juice,Orange-Mandarin,3*8,200 ml
7 - Eleven,ศูนย์กระจายสินค้า RDC สุราษฏร์ธานี,6/17/23,2023-06-17T00:00:00.000Z,2023,6,17,,100%Mandarin Orange Malee 200ml 3x8 Leaf,,BRI,,84.0,Fruit Juice,Orange-Mandarin,3*8,200 ml
7 - Eleven,ศูนย์กระจายสินค้า RDC WESTมหาชัย,6/17/23,2023-06-17T00:00:00.000Z,2023,6,17,,100%Mandarin Orange Malee 200ml 3x8 Leaf,,BRI,,63.0,Fruit Juice,Orange-Mandarin,3*8,200 ml
7 - Eleven,ศูนย์กระจายสินค้า DC5 สุวรรณภูมิ,6/17/23,2023-06-17T00:00:00.000Z,2023,6,17,,100%Mandarin Orange Malee 200ml 3x8 Leaf,,BRI,,168.0,Fruit Juice,Orange-Mandarin,3*8,200 ml
7 - Eleven,ศุนย์กระจายสินค้า หาดใหญ่(RDC หาดใหญ่),6/17/23,2023-06-17T00:00:00.000Z,2023,6,17,,100%Mandarin Orange Malee 200ml 3x8 Leaf,,BRI,,63.0,Fruit Juice,Orange-Mandarin,3*8,200 ml
7 - Eleven,ศุนย์กระจายสินค้า นครสวรรค์(RDC นครสวรรค์),6/17/23,2023-06-17T00:00:00.000Z,2023,6,17,,100%Mandarin Orange Malee 200ml 3x8 Leaf,,BRI,,147.0,Fruit Juice,Orange-Mandarin,3*8,200 ml
7 - Eleven,บริษัท ซีพี ออลล์ จำกัด (มหาชน),6/17/23,2023-06-17T00:00:00.000Z,2023,6,17,,100%Mandarin Orange Malee 200ml 3x8 Leaf,,BRI,,160.0,Fruit Juice,Orange-Mandarin,3*8,200 ml
7 - Eleven,ศูนย์กระจายสินค้า RDCชลบุรีใหม่ W121,6/19/23,2023-06-19T00:00:00.000Z,2023,6,19,,100%Mandarin Orange Malee 200ml 3x8 Leaf,,BRI,,42.0,Fruit Juice,Orange-Mandarin,3*8,200 ml
7 - Eleven,ศูนย์กระจายสินค้า RDC WESTมหาชัย,6/19/23,2023-06-19T00:00:00.000Z,2023,6,19,,100%Mandarin Orange Malee 200ml 3x8 Leaf,,BRI,,168.0,Fruit Juice,Orange-Mandarin,3*8,200 ml
7 - Eleven,ศูนย์กระจายสินค้า DC5 สุวรรณภูมิ,6/19/23,2023-06-19T00:00:00.000Z,2023,6,19,,100%Mandarin Orange Malee 200ml 3x8 Leaf,,BRI,,42.0,Fruit Juice,Orange-Mandarin,3*8,200 ml
7 - Eleven,บริษัท ซีพี ออลล์ จำกัด (มหาชน),6/19/23,2023-06-19T00:00:00.000Z,2023,6,19,,100%Mandarin Orange Malee 200ml 3x8 Leaf,,BRI,,288.0,Fruit Juice,Orange-Mandarin,3*8,200 ml
7 - Eleven,ศูนย์กระจายสินค้าขอนแก่น (W801),6/20/23,2023-06-20T00:00:00.000Z,2023,6,20,,100%Mandarin Orange Malee 200ml 3x8 Leaf,,BRI,,168.0,Fruit Juice,Orange-Mandarin,3*8,200 ml
7 - Eleven,ศูนย์กระจายสินค้า RDC WESTมหาชัย,6/20/23,2023-06-20T00:00:00.000Z,2023,6,20,,100%Mandarin Orange Malee 200ml 3x8 Leaf,,BRI,,42.0,Fruit Juice,Orange-Mandarin,3*8,200 ml
7 - Eleven,ศูนย์กระจายสินค้า DC5 สุวรรณภูมิ,6/20/23,2023-06-20T00:00:00.000Z,2023,6,20,,100%Mandarin Orange Malee 200ml 3x8 Leaf,,BRI,,84.0,Fruit Juice,Orange-Mandarin,3*8,200 ml
7 - Eleven,ศุนย์กระจายสินค้า นครสวรรค์(RDC นครสวรรค์),6/20/23,2023-06-20T00:00:00.000Z,2023,6,20,,100%Mandarin Orange Malee 200ml 3x8 Leaf,,BRI,,147.0,Fruit Juice,Orange-Mandarin,3*8,200 ml
7 - Eleven,ศูนย์กระจายสินค้า RDCชลบุรีใหม่ W121,6/21/23,2023-06-21T00:00:00.000Z,2023,6,21,,100%Mandarin Orange Malee 200ml 3x8 Leaf,,BRI,,105.0,Fruit Juice,Orange-Mandarin,3*8,200 ml
7 - Eleven,ศูนย์กระจายสินค้า RDC สุราษฏร์ธานี,6/21/23,2023-06-21T00:00:00.000Z,2023,6,21,,100%Mandarin Orange Malee 200ml 3x8 Leaf,,BRI,,252.0,Fruit Juice,Orange-Mandarin,3*8,200 ml
7 - Eleven,ศูนย์กระจายสินค้า RDC WESTมหาชัย,6/21/23,2023-06-21T00:00:00.000Z,2023,6,21,,100%Mandarin Orange Malee 200ml 3x8 Leaf,,BRI,,63.0,Fruit Juice,Orange-Mandarin,3*8,200 ml
7 - Eleven,ศุนย์กระจายสินค้า หาดใหญ่(RDC หาดใหญ่),6/21/23,2023-06-21T00:00:00.000Z,2023,6,21,,100%Mandarin Orange Malee 200ml 3x8 Leaf,,BRI,,84.0,Fruit Juice,Orange-Mandarin,3*8,200 ml
7 - Eleven,ศูนย์กระจายสินค้าขอนแก่น (W801),6/22/23,2023-06-22T00:00:00.000Z,2023,6,22,,100%Mandarin Orange Malee 200ml 3x8 Leaf,,BRI,,63.0,Fruit Juice,Orange-Mandarin,3*8,200 ml
7 - Eleven,ศูนย์กระจายสินค้า RDCชลบุรีใหม่ W121,6/22/23,2023-06-22T00:00:00.000Z,2023,6,22,,100%Mandarin Orange Malee 200ml 3x8 Leaf,,BRI,,63.0,Fruit Juice,Orange-Mandarin,3*8,200 ml
7 - Eleven,ศูนย์กระจายสินค้า RDC WESTมหาชัย,6/22/23,2023-06-22T00:00:00.000Z,2023,6,22,,100%Mandarin Orange Malee 200ml 3x8 Leaf,,BRI,,42.0,Fruit Juice,Orange-Mandarin,3*8,200 ml
7 - Eleven,บริษัท ซีพี ออลล์ จำกัด (มหาชน),6/22/23,2023-06-22T00:00:00.000Z,2023,6,22,,100%Mandarin Orange Malee 200ml 3x8 Leaf,,BRI,,187.0,Fruit Juice,Orange-Mandarin,3*8,200 ml
7 - Eleven,ศูนย์กระจายสินค้า RDCชลบุรีใหม่ W121,6/23/23,2023-06-23T00:00:00.000Z,2023,6,23,,100%Mandarin Orange Malee 200ml 3x8 Leaf,,BRI,,168.0,Fruit Juice,Orange-Mandarin,3*8,200 ml
7 - Eleven,ศูนย์กระจายสินค้า RDC WESTมหาชัย,6/23/23,2023-06-23T00:00:00.000Z,2023,6,23,,100%Mandarin Orange Malee 200ml 3x8 Leaf,,BRI,,42.0,Fruit Juice,Orange-Mandarin,3*8,200 ml
7 - Eleven,ศูนย์กระจายสินค้า DC5 สุวรรณภูมิ,6/23/23,2023-06-23T00:00:00.000Z,2023,6,23,,100%Mandarin Orange Malee 200ml 3x8 Leaf,,BRI,,168.0,Fruit Juice,Orange-Mandarin,3*8,200 ml
7 - Eleven,ศูนย์กระจายสินค้าขอนแก่น (W801),6/24/23,2023-06-24T00:00:00.000Z,2023,6,24,,100%Mandarin Orange Malee 200ml 3x8 Leaf,,BRI,,84.0,Fruit Juice,Orange-Mandarin,3*8,200 ml
7 - Eleven,ศูนย์กระจายสินค้า RDC สุราษฏร์ธานี,6/24/23,2023-06-24T00:00:00.000Z,2023,6,24,,100%Mandarin Orange Malee 200ml 3x8 Leaf,,BRI,,63.0,Fruit Juice,Orange-Mandarin,3*8,200 ml
7 - Eleven,ศูนย์กระจายสินค้า RDC WESTมหาชัย,6/24/23,2023-06-24T00:00:00.000Z,2023,6,24,,100%Mandarin Orange Malee 200ml 3x8 Leaf,,BRI,,84.0,Fruit Juice,Orange-Mandarin,3*8,200 ml
7 - Eleven,ศูนย์กระจายสินค้า DC5 สุวรรณภูมิ,6/24/23,2023-06-24T00:00:00.000Z,2023,6,24,,100%Mandarin Orange Malee 200ml 3x8 Leaf,,BRI,,168.0,Fruit Juice,Orange-Mandarin,3*8,200 ml
7 - Eleven,ศุนย์กระจายสินค้า หาดใหญ่(RDC หาดใหญ่),6/24/23,2023-06-24T00:00:00.000Z,2023,6,24,,100%Mandarin Orange Malee 200ml 3x8 Leaf,,BRI,,63.0,Fruit Juice,Orange-Mandarin,3*8,200 ml
7 - Eleven,ศุนย์กระจายสินค้า นครสวรรค์(RDC นครสวรรค์),6/24/23,2023-06-24T00:00:00.000Z,2023,6,24,,100%Mandarin Orange Malee 200ml 3x8 Leaf,,BRI,,147.0,Fruit Juice,Orange-Mandarin,3*8,200 ml
7 - Eleven,บริษัท ซีพี ออลล์ จำกัด (มหาชน),6/24/23,2023-06-24T00:00:00.000Z,2023,6,24,,100%Mandarin Orange Malee 200ml 3x8 Leaf,,BRI,,184.0,Fruit Juice,Orange-Mandarin,3*8,200 ml
7 - Eleven,ศูนย์กระจายสินค้า RDCชลบุรีใหม่ W121,6/26/23,2023-06-26T00:00:00.000Z,2023,6,26,,100%Mandarin Orange Malee 200ml 3x8 Leaf,,BRI,,126.0,Fruit Juice,Orange-Mandarin,3*8,200 ml
7 - Eleven,ศูนย์กระจายสินค้า DC5 สุวรรณภูมิ,6/26/23,2023-06-26T00:00:00.000Z,2023,6,26,,100%Mandarin Orange Malee 200ml 3x8 Leaf,,BRI,,105.0,Fruit Juice,Orange-Mandarin,3*8,200 ml
7 - Eleven,บริษัท ซีพี ออลล์ จำกัด (มหาชน),6/26/23,2023-06-26T00:00:00.000Z,2023,6,26,,100%Mandarin Orange Malee 200ml 3x8 Leaf,,BRI,,249.0,Fruit Juice,Orange-Mandarin,3*8,200 ml
7 - Eleven,ศูนย์กระจายสินค้าขอนแก่น (W801),6/27/23,2023-06-27T00:00:00.000Z,2023,6,27,,100%Mandarin Orange Malee 200ml 3x8 Leaf,,BRI,,63.0,Fruit Juice,Orange-Mandarin,3*8,200 ml
7 - Eleven,ศูนย์กระจายสินค้า RDCชลบุรีใหม่ W121,6/27/23,2023-06-27T00:00:00.000Z,2023,6,27,,100%Mandarin Orange Malee 200ml 3x8 Leaf,,BRI,,42.0,Fruit Juice,Orange-Mandarin,3*8,200 ml
7 - Eleven,ศูนย์กระจายสินค้า RDC WESTมหาชัย,6/27/23,2023-06-27T00:00:00.000Z,2023,6,27,,100%Mandarin Orange Malee 200ml 3x8 Leaf,,BRI,,105.0,Fruit Juice,Orange-Mandarin,3*8,200 ml
7 - Eleven,ศูนย์กระจายสินค้า DC5 สุวรรณภูมิ,6/27/23,2023-06-27T00:00:00.000Z,2023,6,27,,100%Mandarin Orange Malee 200ml 3x8 Leaf,,BRI,,126.0,Fruit Juice,Orange-Mandarin,3*8,200 ml
7 - Eleven,ศุนย์กระจายสินค้า นครสวรรค์(RDC นครสวรรค์),6/27/23,2023-06-27T00:00:00.000Z,2023,6,27,,100%Mandarin Orange Malee 200ml 3x8 Leaf,,BRI,,42.0,Fruit Juice,Orange-Mandarin,3*8,200 ml
7 - Eleven,บริษัท ซีพี ออลล์ จำกัด (มหาชน),6/27/23,2023-06-27T00:00:00.000Z,2023,6,27,,100%Mandarin Orange Malee 200ml 3x8 Leaf,,BRI,,304.0,Fruit Juice,Orange-Mandarin,3*8,200 ml
7 - Eleven,ศูนย์กระจายสินค้า RDCชลบุรีใหม่ W121,6/28/23,2023-06-28T00:00:00.000Z,2023,6,28,,100%Mandarin Orange Malee 200ml 3x8 Leaf,,BRI,,84.0,Fruit Juice,Orange-Mandarin,3*8,200 ml
7 - Eleven,ศูนย์กระจายสินค้า RDC สุราษฏร์ธานี,6/28/23,2023-06-28T00:00:00.000Z,2023,6,28,,100%Mandarin Orange Malee 200ml 3x8 Leaf,,BRI,,252.0,Fruit Juice,Orange-Mandarin,3*8,200 ml
7 - Eleven,ศูนย์กระจายสินค้า RDC WESTมหาชัย,6/28/23,2023-06-28T00:00:00.000Z,2023,6,28,,100%Mandarin Orange Malee 200ml 3x8 Leaf,,BRI,,63.0,Fruit Juice,Orange-Mandarin,3*8,200 ml
7 - Eleven,ศูนย์กระจายสินค้า DC5 สุวรรณภูมิ,6/28/23,2023-06-28T00:00:00.000Z,2023,6,28,,100%Mandarin Orange Malee 200ml 3x8 Leaf,,BRI,,84.0,Fruit Juice,Orange-Mandarin,3*8,200 ml
